course_id,course_gpa,valid_sections,total_graded,title,description,department
MSE69,2.723684210526316,5.0,228.0,Electronic and Optical Properties in Materials,"Covers the electronic, optical, and dielectric properties of crystalline and amorphous materials to provide a foundation of the underlying physical principles governing the properties of existing and emerging electronic and photonic materials.",MSE
MUSIC10,3.5714285714285716,7.0,105.0,Piano for Majors,"For Music majors with little or no piano experience. Provides the necessary background for realizing keyboard exercises required in the theory and harmony courses, and develops skills to play and sight-read simple music from different periods.",MUSIC
MUSIC132,3.018867924528302,3.0,53.0,Jazz Theory,"Study of jazz harmony and melody construction in improvisation. Covered topics include terminology, chord symbols, notation, voicings, and scales as commonly used in jazz and popular music. Issues regarding tonality and ramifications of the blue scale are also examined.",MUSIC
MUSIC147,3.953125,4.0,64.0,Studies in Music Technology,"Specialized topics in electronic music, computer-aided music, and other aspects of music technology.",MUSIC
MUSIC148,3.6941747572815533,8.0,206.0,Studies in Ethnomusicology,Topics in Ethnomusicology.,MUSIC
MUSIC15,3.486842105263158,12.0,228.0,Musicianship,"Interval and chord quality identification, melodic and harmonic dictation, tonal and chromatic sight-singing, and rhythmic reading and dictation.",MUSIC
MUSIC150,3.5918367346938775,3.0,49.0,Composition,Exercises and projects for diverse instrumental-vocal combinations; contemporary techniques and problems. Participation in the improvisation ensemble and working with electronic media.,MUSIC
MUSIC155,3.0220264317180616,11.0,227.0,Analysis,"Methods of formal analysis applicable to all Western musical styles: additive, continuous, transformational, and hierarchic forms; rhythm, texture, and sonority as form and process.",MUSIC
MUSIC15A,2.8547486033519553,9.0,179.0,Musicianship I,"Interval and chord quality identification, melodic and harmonic dictation, tonal and chromatic sight-singing, and rhythmic reading and dictation.",MUSIC
MUSIC15B,2.9365079365079363,10.0,189.0,Musicianship II,"Interval and chord quality identification, melodic and harmonic dictation, tonal and chromatic sight-singing, and rhythmic reading and dictation.",MUSIC
MUSIC15C,3.08,8.0,150.0,Musicianship III,"Interval and chord quality identification, melodic and harmonic dictation, tonal and chromatic sight-singing, and rhythmic reading and dictation.",MUSIC
MUSIC160,3.9828722002635044,35.0,1518.0,University Orchestra,Study and performance of standard orchestral repertory and works by contemporary composers. Membership is open to all qualified students by audition only.,MUSIC
MUSIC162,3.950910530482977,17.0,1263.0,University Chorus,"Make-up of the ensembles varies and may include University Chorus, Chamber Choir, Madrigal Singers, Women's Chorus, and Reading Choir. Membership is open to all students.",MUSIC
MUSIC164,3.9741935483870967,9.0,155.0,Opera Workshop,"Preparation and performance of operatic repertoire, including arias, scenes, and fully staged operas, and/or stage training and role analysis.",MUSIC
MUSIC16A,3.2851985559566788,10.0,277.0,Music Theory,"Review of music fundamentals. Triad and seventh chords, musical texture, chord spacing, embellishing tones, and introduction to diatonic harmony. Part-writing and model composition with tonic, dominant seventh, and subdominant harmonies.",MUSIC
MUSIC16B,3.195195195195195,12.0,333.0,Music Theory,"Introduction to phrase structure. Part-writing and harmonization with predominants, linear dominants, 6/4 embellishing chords, leading-tone and other diatonic seventh chords. Advanced meters and rhythmic-metric dissonance. Diatonic sequence. Introduction to tonicization and modulation through motion to V and III.",MUSIC
MUSIC16C,3.142857142857143,10.0,294.0,Music Theory,"Tonicization and modulation to closely related keys. Simple binary and ternary forms. Voice-leading reductions and simple forms. Diatonic sequence with seventh chords. Introduction to chromatic harmony I: modal exchange and mixture chords, the Neapolitan and augmented sixth chords.",MUSIC
MUSIC16D,3.067901234567901,12.0,324.0,Theory/Musicianship,"Extended homophonic and contrapuntal formal designs (continuous variations, rondo form, sonata form, invention, fugue). Embellishing chromatic chords, dominant prolongation, modulations to foreign keys, extended harmonies, chromatic sequence, chromatic voice-leading and symmetrical divisions of the octave.",MUSIC
MUSIC171,3.925189393939394,35.0,1056.0,Chamber Singers,A select ensemble specializing in vocal chamber music from all periods. Frequent performances on and off campus. Membership is open to all singers by audition. Materials Fee,MUSIC
MUSIC176,3.955115511551155,34.0,1515.0,Chamber Ensembles ,"Make-up of the ensembles varies and may include various Classical ensembles, Latin Jazz Ensemble, Small Jazz Combos, Percussion Ensemble, and Guitar Ensemble. Membership is open to all qualified students by audition only.",MUSIC
MUSIC178,3.994962216624685,22.0,397.0,Jazz Orchestra,Rehearsal and performance of literature written for large jazz ensemble with emphasis on methods and materials. Laboratory setting for new arrangers and/or composers of modern jazz pieces.,MUSIC
PERSIAN1A,3.883211678832117,7.0,137.0,Fundamentals in Persian,"Designed for students with little or no exposure to Persian. Students learn the modern writing system and grammar of Persian. Facilitates basic reading, writing, and speaking skills and fosters college-level literacy in Persian culture.",PERSIAN
PERSIAN1B,3.909090909090909,6.0,99.0,Fundamentals in Persian,"Designed for students with little or no exposure to Persian. Students learn the modern writing system and grammar of Persian. Facilitates basic reading, writing, and speaking skills and fosters college-level literacy in Persian culture.",PERSIAN
PERSIAN1C,3.9375,3.0,48.0,Fundamentals in Persian,"Designed for students with little or no exposure to Persian. Students learn the modern writing system and grammar of Persian. Facilitates basic reading, writing, and speaking skills and fosters college-level literacy in Persian culture.",PERSIAN
PERSIAN50,3.943661971830986,8.0,284.0,Topics in Persian Culture,"Study of varied topics in Persian culture, area studies, and society, both in the present and in historical perspective. Topics are not normally repeated for a two-year period.",PERSIAN
PHYSCI105,3.7333333333333334,6.0,105.0,California Teach 2: Middle School Science and Mathematics Teaching,"Second in a series for students interested in becoming middle or high school teachers of mathematics or science. Students gain an understanding of effective, research-based teaching strategies for grades 6-8. Includes supervised field experience in a middle school classroom.",PHY SCI
PHYSCI139W,3.342995169082126,32.0,621.0,Technical Writing and Communication Skills,"Workshop in writing technical reports, journal articles, proposals. Oral presentations. Communicating with the public. May not be used in satisfaction of any School or departmental requirement.",PHY SCI
PHYSCI5,3.665644171779141,19.0,326.0,California Teach 1: Introduction to Science and Mathematics Teaching,"First in a series for students interested in becoming middle or high school teachers of mathematics or science. Students gain an understanding of effective, research-based teaching strategies. Includes supervised field experience in a K-12 classroom.",PHY SCI
PHYSICS106W,3.7567567567567566,6.0,111.0,"Advanced Data Acquisition, Analysis, and Scientific Writing","Introduces modern practical laboratory techniques for developing data interface devices, acquiring and analyzing data, and writing up results in manuscript format. Experiments include interfacing with instruments through software and hardware development, PID controller, Fourier analysis, and lock-in amplifier.",PHYSICS
PHYSICS111A,2.9342105263157894,14.0,912.0,Classical Mechanics,"One-dimensional motion and oscillations; three-dimensional motion, non-inertial coordinates, conservation laws, and Lagrangian and Hamiltonian dynamics; rigid body motion and relativity.",PHYSICS
PHYSICS111B,2.939485627836611,12.0,661.0,Classical Mechanics,"One-dimensional motion and oscillations; three-dimensional motion, non-inertial coordinates, conservation laws, and Lagrangian and Hamiltonian dynamics; rigid body motion and relativity.",PHYSICS
PHYSICS112A,2.6306010928961747,13.0,915.0,Electromagnetic Theory,"Electric, magnetic, and gravitational fields and potentials; electrodynamics; mechanical and electromagnetic waves and radiation.",PHYSICS
PHYSICS112B,2.7207678883071553,11.0,573.0,Electromagnetic Theory,"Electric, magnetic, and gravitational fields and potentials; electrodynamics; mechanical and electromagnetic waves and radiation.",PHYSICS
PHYSICS113A,2.775616083009079,13.0,771.0,Quantum Mechanics,"The wave function and its interpretation; time independent and time dependent Schrödinger equation; Hilbert space and the uncertainty principle; systems in one to three dimensions; the hydrogen atom, angular momentum and spin.",PHYSICS
PHYSICS113B,3.342857142857143,9.0,245.0,Quantum Mechanics,"Identical particles in quantum systems; atoms and the periodic table; theories of solids; time-independent perturbation theory; fine structure of hydrogen, the Zeeman effect and hyperfine structure; the variational principle; the WKB approximation and tunneling.",PHYSICS
PHYSICS113C,3.640625,4.0,64.0,Quantum Mechanics,Symmetries and conservation laws in quantum mechanics; degeneracy; quantum dynamics and selection rules; scattering theory; time-dependent perturbation theory; emission and absorption of radiation; Fermi's golden rule; selected contemporary topics.,PHYSICS
PHYSICS115A,2.9410256410256412,13.0,780.0,Statistical Physics,"Microscopic theory of temperature, heat, and entropy; kinetic theory; multicomponent systems; quantum statistics.",PHYSICS
PHYSICS116,3.1140684410646386,10.0,263.0,Relativity and Black Holes,"Introduces students to both special and general relativity; includes the formalism of four-vectors, equivalence principle, curved space-time, and modern issues with black holes.",PHYSICS
PHYSICS12,3.0952380952380953,3.0,63.0,Science Fiction and Science Fact,"An introduction to fundamental physics principles, the scientific process, and the mathematical language of science, used to analyze topics drawn from superheroes, science fiction works, and current science news to distinguish science fiction and science fact.",PHYSICS
PHYSICS120,3.5533333333333332,6.0,150.0,Electronics for Scientists,"Applications of modern semiconductor devices to physical instrumentation. Characteristics of semiconductor devices, integrated circuits, analog and digital circuits. Materials Fee",PHYSICS
PHYSICS121W,3.411111111111111,20.0,450.0,Advanced Laboratory,"Experiments in atomic, condensed matter, quantum, nuclear, particle, and plasma physics. Introduction to instrumentation, computational methods for data analysis, and a first experience in the research laboratory.",PHYSICS
PHYSICS125A,3.4876543209876543,12.0,648.0,Mathematical Physics,Complex variables; Legendre and Bessel functions; complete sets of orthogonal functions; partial differential equations; integral equations; calculus of variations; coordinate transformations; special functions and series.,PHYSICS
PHYSICS125B,3.8046875,4.0,128.0,Mathematical Physics,Complex variables; Legendre and Bessel functions; complete sets of orthogonal functions; partial differential equations; integral equations; calculus of variations; coordinate transformations; special functions and series.,PHYSICS
PHYSICS133,3.5576923076923075,3.0,52.0,Introduction to Condensed Matter Physics,Phenomena of solids and their interpretation in terms of quantum theory.,PHYSICS
PHYSICS134A,3.4038461538461537,3.0,52.0,Physical and Geometrical Optics,"Focuses on the practical aspects of optics and optical engineering, starting at the fundamentals. Topics include geometrical optics, ray tracing, polarization optics, interferometers, and diffractive optics.",PHYSICS
PHYSICS136,3.4444444444444446,3.0,54.0,Introduction to Particle Physics,Experimental techniques and theoretical concepts of high-energy phenomena: accelerators and detectors; classification of particles and interactions; particle properties; symmetries and mass multiplets; production and decay mechanisms.,PHYSICS
PHYSICS137,3.1308724832214767,9.0,298.0,Introduction to Cosmology,"Solution of the differential equations governing the expansion of the Universe. Observational determinations of the parameters governing the expansion. Big Bang inflation, primordial nucleosynthesis, and cosmic microwave background. Dark matter, dark energy, and large-scale structure of the Universe.",PHYSICS
PHYSICS138,2.9289940828402368,7.0,169.0,Astrophysics of Galaxies,"Introduction to the solar neighborhood, Milky Way, and other galaxies. Interstellar medium. Star formation. Stellar populations. Evolution of spiral, elliptical, and irregular galaxies. Supermassive black holes, quasars, and active galaxies. Galaxies as probes of the expansion rate of the Universe.",PHYSICS
PHYSICS139,3.168421052631579,8.0,190.0,Observational Astrophysics,"Telescopes and astronomical observations, imaging with CCD detectors and image processing techniques. Photometry and spectroscopy of stars, galaxies, and quasars. Advanced imaging techniques such as deconvolution, adaptive optics, and interferometry.",PHYSICS
PHYSICS14,3.3457943925233646,11.0,321.0,Energy and the Environment,"The physics of society’s energy production and consumption, and of their influences on the environment. Topics include fossil and renewable energy resources; nuclear power; prospects for a hydrogen economy; efficient and environmentally benign transportation; efficient home and commercial energy usage.",PHYSICS
PHYSICS144,3.1481481481481484,4.0,135.0,Stellar Astrophysics,"Stars: their structure and evolution; physical state of the interior; the Hertzprung- Russell diagram, stellar classification, and physical principles responsible for the classification; star formation; nuclear burning; giant and dwarf stars; neutron stars and black holes.",PHYSICS
PHYSICS145,3.3797468354430378,3.0,79.0,High-Energy Astrophysics,"Production of radiation by high-energy particles, white dwarfs, neutron stars, and black holes. Evolution of galactic nuclei, radio galaxies, quasars, and pulsars. Cosmic rays and the cosmic background radiation.",PHYSICS
PHYSICS15,3.3815789473684212,5.0,152.0,Physics of Music,"Introduces basic physical principles underlying generation and properties of music, including basic properties of sound waves, musical scales and temperament, musical instruments, and acoustics of music halls. No mathematics background required, but high school algebra is recommended.",PHYSICS
PHYSICS150,3.318840579710145,3.0,69.0,Special Topics in Physics and Astronomy,"Current topics in physics. Includes topics from nano-science, biological sciences, astrophysics, and the common use of estimation across subdisciplines within physics.",PHYSICS
PHYSICS18,3.0822179732313577,11.0,523.0,How Things Work,"Survey of the physical basis of modern technology, with an emphasis on electronics and materials. Topics include power generation and distribution, communication (radio, TV, telephone, computers, tape recorders, CD players), imaging (optics, x-rays, MRI), and modern materials (alloys, semiconductors, superconductors).",PHYSICS
PHYSICS194,3.5297619047619047,18.0,672.0,Research Communication for Physics Majors,"Students learn the fundamentals of communicating about research. Topics include preparing abstracts, proposals, and literature reviews. Provides preparation for presentation of independent research projects in PHYSICS 121 and PHYSICS 196.",PHYSICS
PHYSICS2,3.1041058237416252,46.0,5821.0,Introduction to Mathematical Methods for Physics,"Provides the applied mathematics and problem solving/presentation skills necessary for success in an introductory physics sequence. Focuses on practical exercises in problem solving. Covers kinematics in one and two dimensions in detail. Additional topics include vectors, differentiation, and integration.",PHYSICS
PHYSICS20A,3.1947318908748823,35.0,3189.0,Introduction to Astronomy,"History of astronomy. Underlying physics. Objects in the solar system and how they are studied. Properties of stars: their formation, structure, and evolution. Pulsars and black holes. Galaxies and quasars.",PHYSICS
PHYSICS20B,3.394876601062168,21.0,3201.0,Cosmology: Humanity's Place in the Universe,"An overview of the origin, evolution, and ultimate fate of the Universe. Galaxies and dark matter. The Big Bang and dark energy. Ancient world models.",PHYSICS
PHYSICS20D,3.2260711030082043,10.0,1097.0,Space Science,"Space exploration. Human missions to the moon, Mars, and beyond. Space stations, observatories, and deep-space probes. Robots and drones on distant worlds. Propulsion mechanisms, rockets, space flight, and the dangers of solar radiation.",PHYSICS
PHYSICS20E,3.3731629392971247,21.0,3130.0,Life in the Universe,"An overview of the scientific quest to discover life elsewhere in the universe. Topics include the origin of life on Earth, Mars, extra-solar planets, interstellar travel, and extra-terrestrial intelligence.",PHYSICS
PHYSICS21,3.080357142857143,5.0,112.0,Special Topics in Physics,"Topics addressed vary each quarter. Past topics have included physics and music, Newton, planetary science. Lectures on areas of special interest in physics used to introduce students to scientific method, fundamental laws of science, qualitative and quantitative analysis of data.",PHYSICS
POLSCI121C,3.1740812379110253,7.0,517.0,U.S. Elections and Voting Behavior,"Examines how voters evaluate political parties, candidates, and issues in electoral campaigns to reach their decisions. Numerous controversies concerning the degree of issue voting, sophistication of candidate evaluations, and the decline of political parties are discussed.",POL SCI
POLSCI146B,3.4120603015075375,7.0,199.0,Religion and World Politics,"Examines the relationship between religion and world politics historically and today, focusing on connections with peace/war, democracy, human rights, secularism(s), and globalization. Covers major debates, scholarship, concepts, and theories through class exercises, exams, and essays.",POL SCI
POLSCI147D,3.5,3.0,112.0,International Organizations,"Active learning course that examines origins, decision-making processes, activities, and evolution of leading international organizations (e.g. U.N., NATO, EU, AU, WTO, World Bank, IMF). Activities include drafting reforms, applying theory, assessing dysfunctions, and participating in U.N. negotiation simulations.",POL SCI
PSCI100,3.5420494699646645,17.0,1415.0,Special Topics in Social Behavior,Course content varies with interest of instructor.,PSCI
PSCI101D,3.4937100433078987,19.0,4849.0,Life Span Developmental Psychology,"Addresses the major issues, concepts, and methods of life span developmental psychology. The fundamental theories, distinctive methods, and the physical, perceptual, cognitive, social, motivational, and emotional development for each developmental phase of the life course are considered.",PSCI
PSCI102C,3.5657870110424854,22.0,5343.0,Abnormal Psychology,"Survey of disorders organized by the diagnostic categories of the American Psychiatric Association. Interdisciplinary orientation combines environmental, psychological, and organic perspectives on etiology and treatment.",PSCI
PSCI103H,3.4107142857142856,25.0,4928.0,Health Psychology,"Theory and research are considered as they contribute to an understanding of the role of psychological processes in health and illness. The distinction between prevention and treatment of illness is established, and a variety of psychosocial interventions are elaborated.",PSCI
PSCI104S,3.3008633633633635,22.0,5328.0,Social Animal: An Introduction to Social Psychology,"Theories and research exploring social behavior and social influences on behavior. Topics include methods of social research, attitude formation and change, social perception, the social self, stereotypes and prejudice, conformity, obedience, altruism, aggression, interpersonal relationships and love, and group behavior.",PSCI
PSCI110D,2.983151635282458,8.0,1009.0,Infant Development,"Study of human development from conception through the first two years of life, covering processes and events in the domains of physical, social, and cognitive development.",PSCI
PSCI111D,3.451718494271686,10.0,1833.0,Child Development,"Examines social, emotional, and intellectual growth and development between the ages of 2 and 12 years.",PSCI
PSCI112D,3.053204353083434,7.0,827.0,Adolescent Development,"Examines current research on the biological, social, and cultural contexts of adolescent development. Topics include the impacts of puberty, adolescents' decision-making competencies, changes in family and peer relationships, identity development, and psychosocial problems such as depression and problem behavior.",PSCI
PSCI118D,3.541519434628975,4.0,1132.0,Human Sexuality,"A broad survey of human sexuality encompassing genetic factors, physiological and anatomical development, customary and atypical forms of behavior, reproductive processes, and cultural determinants.",PSCI
PSCI11A,3.5648090169067,29.0,3194.0,Psychology Fundamentals,"Part of a three-course series that provides a comprehensive introduction to psychology. Required for students majoring in Cognitive Sciences, Psychological Science, and Psychology. Topics include the science of psychology, research methods, biology and behavior, consciousness, sensation, and perception.",PSCI
PSCI11B,3.3128691983122365,32.0,4740.0,Psychology Fundamentals,"Part of a three-course series that provides a comprehensive introduction to psychology. Required for students majoring in Cognitive Sciences, Psychological Science, or Psychology. Topics include learning and memory, thinking, language and intelligence, human development, emotion, and motivation.",PSCI
PSCI11C,3.054585152838428,25.0,4122.0,Psychology Fundamentals,"Part of a three-course series that provides a comprehensive introduction to psychology. Required for students majoring in Cognitive Sciences, Psychological Science, or Psychology. Topics include personality psychology, social psychology, abnormal and clinical psychology, and health psychology.",PSCI
PSCI127D,3.375366568914956,4.0,1023.0,Attachment Relationships,"Students learn about the development of attachment-related needs throughout development, as well as the links between attachment and emotion, psychopathology and treatment. Lectures emphasize classic as well as cutting-edge research and are supplemented by primary source readings.",PSCI
PSCI136H,3.429787234042553,3.0,235.0,Behavioral Medicine,"Examines biobehavioral aspects of health and illness, focusing on how stress contributes to or exacerbates disease processes. Background information on psychosomatic medicine and stress models and detailed examination of specific organ systems emphasizing the reactivity of these systems to stress.",PSCI
PSCI137H,3.3952738990332976,7.0,931.0,Human Stress,"Stress as a multidisciplinary topic. Biological, psychological, and sociological approaches to adaptation-related disorders. Effects of acute and chronic stress on emotions, physiology, and behavior. Methods of stress assessment, stress reduction, and intervention.",PSCI
PSCI139H,3.6294989414255467,7.0,1417.0,Clinical Sport Psychology,"An interdisciplinary introduction to clinical sport psychology, that includes, among other things, an introduction to psychopathology in sport; plus the use of psychological skills training, including anxiety reduction techniques, visualization, self-efficacy, coping skills, concentration, and goal-setting in sports.",PSCI
PSCI141H,3.087912087912088,4.0,182.0,Clinical Health Psychology,"Behavioral role in etiology, treatment, and prevention of certain diseases. Behavioral intervention including biofeedback, stress-, pain-management, health habit counseling, and other skills to assist patients make cognitive, emotional, and behavioral changes needed to cope with disease or achieve better health.",PSCI
PSCI143H,3.706909090909091,5.0,1375.0,The Science and Practice of Wellness and Resilience ,"Wellness is a common, but elusive goal. Covers the history, theory, psychology, and behavioral science behind skills for wellness and resilience. Provides opportunities to practice the strategies to help further understanding of the behavioral nature of each of the areas.",PSCI
PSCI150C,3.564917656070471,9.0,2611.0,Clinical Psychology,"Overview of theories, assessment techniques, research methodologies, and intervention approaches in clinical psychology. Psychodynamic, behavioral, humanistic, and cognitive perspectives are examined along with ethical and professional issues.",PSCI
PSCI152C,3.0894736842105264,3.0,190.0,Clinical Child Psychology,"Examines research and theory concerning childhood psychopathology behavior disorders. Diagnosis and assessment, early identification of high-risk children, fears and phobias, antisocial behavior, childhood psychoses, autism, depression, attention deficit/hyperactivity disorders, and ethical and policy implications of identifying children who are different.",PSCI
