course_id,course_gpa,valid_sections,total_graded,title,description,department
EUROSTS11,3.6923076923076925,7.0,520.0,Europe's Futures: 1755-Present,"Introduces students to competing approaches from humanities and social sciences to conceptualizing the future in politics, art, and literature. From the enlightenment to today, investigates the cultural and political context of moments when new ideas emerged to secure Europe's futures.",EURO ST
FLM&MDA101A,3.294152744630072,12.0,1676.0,History of Film I: The Silent Era,"The aesthetic, industrial, and socio-historical developments of cinema in the U.S. and internationally from its invention to the adoption of synchronous sound. Includes early exhibition, developments in narrative and editing, the formation of the studio system, and avant-garde film movements. Materials Fee",FLM&MDA
FLM&MDA101B,3.3572289156626507,12.0,1660.0,History of Film II: The Studio Era,"The aesthetic, industrial, and socio-historical developments of cinema in the U.S. and internationally from the 1930s through the 1960s. Includes the Hollywood studio system, propaganda films, Italian neorealism, post-war Japanese cinema, and the French New Wave. Materials Fee",FLM&MDA
FLM&MDA101C,3.272781065088757,17.0,1690.0,History of Film III: The Contemporary Era,"The aesthetic, industrial, and socio-historical developments of cinema in the U.S. and internationally from the late 1960s to the present. Includes New Hollywood and independent U.S. films, ethnic cinemas, postcolonial cinemas, East-Asian new waves, and digital filmmaking. Materials Fee",FLM&MDA
FLM&MDA110,3.3888506538196834,65.0,1453.0,Film and Media Theory,"Survey of major directions in film and media theory. Various theories of mass culture, realism, auteurism, semiotics, feminism, cultural studies, and theories of other media, with an emphasis on developing the student’s ability to analyze and articulate a theoretical argument. Materials Fee",FLM&MDA
FLM&MDA111,3.8051948051948052,5.0,77.0,Film and Media Theory and Practice,"Seminar focusing on issues in film and media production and editing. Reading and exercises to understand aspects of film and media production (montage, sound, film movement, directing, and mise en scène), and how ideology works in tandem with style.",FLM&MDA
FLM&MDA112,3.1314741035856573,16.0,502.0,Topics in Genre Study ,"Critical approaches to the serial productions we call ""genre"" films such as westerns, weepies, musicals, horror films, and others; televisual genres such as sitcoms, drama, comedy, news, docudrama, police; Internet categories such as chat-rooms, listservs, Web pages.",FLM&MDA
FLM&MDA113,3.2142857142857144,3.0,84.0,Topics in Narrative/Image ,"What relations do sound, image, and story assume in film, television, video, and Internet narratives? In what ways do these media interact with and borrow from each other and traditional story-telling media? How have the new media explored non-narrative strategies?",FLM&MDA
FLM&MDA114,3.2739726027397262,3.0,73.0,"Film, Media, and the Arts","A synthetic entity, film draws on both established and popular arts. Looks at visual media's exchanges with ""high"" and ""low"" culture, exploring its relation to areas such as photography, music, painting, and architecture.",FLM&MDA
FLM&MDA115,3.297592997811816,12.0,457.0,Topics in Authorship ,"Theoretical and analytical discussions of visual media authorship, focusing on case studies of directors, producers, scriptwriters, and film, video, and digital artists.",FLM&MDA
FLM&MDA117A,3.6468200270635993,31.0,739.0,Introduction to Screenwriting,"Introduction to the technique and format of the screenplay, with a particular focus on its three act structural elements: coverage, treatment, and 60 beat outline. Materials Fee",FLM&MDA
FLM&MDA118A,3.5839416058394162,6.0,137.0,Writing Television I,"Introduction to the technique and format of the television screenplay. Focuses on character, storytelling, structure, and scene development; culminating in a one-hour drama series treatment and first act of the pilot.",FLM&MDA
FLM&MDA120A,3.8033195020746886,53.0,1205.0,Basic Production,"Introduction to the basic apparatus of video/film production. The elementary essentials of production, including the use of camera and lenses, lighting, editing, and sound. Materials Fee",FLM&MDA
FLM&MDA120B,3.8629441624365484,20.0,394.0,Intermediate Production,"Students work on individual and group projects, utilizing skills and insights introduced in Film and Media Studies 120A. Materials Fee",FLM&MDA
FLM&MDA120C,3.861111111111111,6.0,108.0,Production Workshop,"As film and video are collaborative media, students form production groups and ultimately produce final 10-15-minute film/video projects. Materials Fee",FLM&MDA
FLM&MDA130,3.4459770114942527,45.0,1305.0,Multicultural Topics in the Media,"Investigation of media representations of gender, race, and sexuality in the United States. Topics include media images of and by one or more minority groups in the United States, including African Americans, Asian Americans, Chicano/Latinos, Native Americans, gays, and lesbians.",FLM&MDA
FLM&MDA139W,3.337719298245614,82.0,1596.0,Writing on Film and Media,"Writing on cinema, television, and/or digital culture, emphasizing identification of reliable sources, close readings, addressing academic, professional, and/or popular audiences. Requires at least 4,000 words of assigned composition.",FLM&MDA
FLM&MDA144,3.529933481152993,14.0,451.0,Studies in New Media,"Advanced analysis of the technologies, texts, theories, and cultures of computers, video games, networks, or platforms.",FLM&MDA
FLM&MDA145,3.373996789727127,20.0,623.0,Topics in Popular Culture and Media,"Considers the forms, ideologies, consumption, and marketing of popular entertainment and technologies. May focus on cultural studies methods, transnational approaches, and synergy between media.",FLM&MDA
FLM&MDA146,3.3306772908366535,7.0,251.0,Topics in Sound Studies,"Focuses on the production, theories, and meanings of sound recordings, music, and/or audio technologies. Topics may include the cultures of popular music and audio devices, music television, and theories of film sound.",FLM&MDA
FLM&MDA151,3.4326923076923075,4.0,104.0,Topics in Documentary and Experimental Film and Media,"Examines nonfiction and/or experimental cinemas and media, such as documentary, the historical avant-garde, video art, and activist media. Students consider the specific aesthetics and ideologies of forms distinct from narrative feature films.",FLM&MDA
FLM&MDA160,3.4464621164683784,54.0,1597.0,National/Regional Cinemas and Media,"National schools, period styles, or cultural movements beyond U.S. cinema, as defined by national borders or by geographic regions, such as Latin America. May be approached from a comparative perspective.",FLM&MDA
FLM&MDA161,3.4729411764705884,14.0,425.0,Global/Transnational Cinemas and Media,"Analyzes the multinational production, circulation, and reception of film and media texts beyond singular national borders or specific geographic regions. Topics may include transnational co-productions, exports, and diasporic reception.",FLM&MDA
FLM&MDA162,3.4785714285714286,4.0,140.0,Topics in US Cinema ,"Explores the modes of production and distribution, aesthetics, and contexts that have shaped cinema in the United States. Topics may include classical Hollywood, American independent cinema, or periods such as 1970s cinema.",FLM&MDA
FLM&MDA185,3.452887537993921,10.0,329.0,Topics in Television and New Media,"Advanced seminar focusing on special topics in television and new media. Past examples have included courses on media marketing and brand identity; television and sound; game theory; and other issues related to popular culture, broadcast media, and new media technologies.",FLM&MDA
FLM&MDA190,3.3807615230460923,16.0,499.0,Special Topics in Film and Modern Media,"Special issues concerned with film and media history, theory, and criticism.",FLM&MDA
FLM&MDA191,3.5845824411134903,19.0,467.0,Special Topics in Critical Practice,"Integrates critical analysis, historical, and theoretical methods with creative projects to illuminate film and media production and industries. May include courses in adaptation, writing television, media activism, writing the short film, performance studies, and movie title sequences.",FLM&MDA
FLM&MDA192,3.756880733944954,13.0,218.0,Special Topics in Advanced Film Production,"Focuses on special topics in production. Culminates in final 6-10-minute group film projects. Topics include producing, acting, and/or directing in short films, experimental films, documentaries, television, and other media.",FLM&MDA
FLM&MDA194,3.3947368421052633,4.0,76.0,Special Topics in Interdisciplinary Studies,"Interdisciplinary approaches to special issues concerned with film and media history, theory, and criticism.",FLM&MDA
FLM&MDA85,3.274834437086093,4.0,604.0,Introduction to Film and Visual Analysis,"Introduces the language and techniques of visual and film analysis. Teaches students to analyze the moving image; emphasize framing, camera movement, and sound; and conveys how editing produces meaning, reproduces historical ideologies, fosters or disrupts narrative, and cues spectators. Materials Fee",FLM&MDA
FLM&MDA85A,3.165625,30.0,4160.0,Introduction to Film and Visual Analysis,"Introduces the language and techniques of visual and film analysis. Teaches students to analyze the moving image; emphasize framing, camera movement, and sound; and conveys how editing produces meaning, reproduces historical ideologies, fosters or disrupts narrative, and cues spectators.",FLM&MDA
FLM&MDA85B,3.113913751017087,16.0,2458.0,Broadcast Media History and Analysis,"History of broadcast media from the radio era to the present day, including social, political, institutional, and audience analysis as well as methods of visual and aural analysis of these media.",FLM&MDA
FLM&MDA85C,3.3394085281980743,15.0,2908.0,New Media and Digital Technologies,"The study of digital media, computer-mediated communication, and Internet cultures, from historical and theoretical perspectives.",FLM&MDA
FRENCH100A,3.5443037974683542,4.0,79.0,Advanced French Writing: Reading and Telling Stories,Study and practice of various forms of writing including.,FRENCH
FRENCH101B,3.5,3.0,48.0,Introduction to 18th-Century French Literature,Literature and philosophy of the 18th century studied in relationship to a specific literary or historical problem.,FRENCH
FRENCH150,3.2937853107344632,8.0,177.0,Topics in French Literature and Culture,"Study of a theme, movement, or problem crucial to understanding French Literature and Culture.",FRENCH
FRENCH160,3.272727272727273,3.0,66.0,French Cinema,"Study of a period, movement, or theme in French or Francophone cinema.",FRENCH
FRENCH1A,3.58745247148289,57.0,1052.0,Fundamentals of French,"First quarter of first-year French in a hybrid format. Students are taught to conceptualize in French as they learn to understand, read, write, and speak. Classes are conducted entirely in French.",FRENCH
FRENCH1ABSP,3.6666666666666665,5.0,96.0,Accelerated Fundamentals of French for Spanish Speakers,"First half of first-year French in an accelerated form and hybrid format designed for Spanish Speakers. Students are taught to conceptualize in French as they learn to understand, read, write, and speak. Classes are conducted entirely in French.",FRENCH
FRENCH1B,3.553444180522565,40.0,842.0,Fundamentals of French,"Second quarter of first-year French in a hybrid format. Students are taught to conceptualize in French as they learn to understand, read, write, and speak. Classes are conducted entirely in French.",FRENCH
FRENCH1BCSP,3.5319148936170213,3.0,47.0,Accelerated Fundamentals of French for Spanish Speakers,"Second half of first-year French in an accelerated form and hybrid format designed for Spanish Speakers. Students are taught to conceptualize in French as they learn to understand, read, write, and speak. Classes are conducted entirely in French.",FRENCH
FRENCH1C,3.5603799185888736,36.0,737.0,Fundamentals of French,"Third quarter of first-year French in a hybrid format. Students are taught to conceptualize in French as they learn to understand, read, write, and speak. Classes are conducted entirely in French.",FRENCH
FRENCH2A,3.4784110535405874,30.0,579.0,Intermediate French,"Second-year French in a hybrid format. Students are taught to conceptualize in French as they learn to understand, read, write, and speak. Classes are conducted entirely in French.",FRENCH
FRENCH2B,3.481549815498155,27.0,542.0,Intermediate French,"Second-year French in a hybrid format. Students are taught to conceptualize in French as they learn to understand, read, write, and speak. Classes are conducted entirely in French.",FRENCH
FRENCH2C,3.4613636363636364,20.0,440.0,Intermediate French,"Second-year French in a hybrid format. Students are taught to conceptualize in French as they learn to understand, read, write, and speak. Classes are conducted entirely in French.",FRENCH
FRENCH50,3.4849624060150375,14.0,532.0,Topics in French Culture and the Modern World,"Introductory course for non-majors. Focuses on France's role in the modern world and its cultural connections to Asia, the Middle East, Africa, Europe, and the Americas. Taught in English.",FRENCH
FRENCHS2AB,3.112,6.0,125.0,Intermediate French,"First half/second half of second-year French in an intensified form. Students are taught to conceptualize in French as they learn to understand, read, write, and speak. Classes are conducted entirely in French.",FRENCH
FRENCHS2BC,3.5580110497237567,8.0,181.0,Intermediate French,"First half/second half of second-year French in an intensified form. Students are taught to conceptualize in French as they learn to understand, read, write, and speak. Classes are conducted entirely in French.",FRENCH
GDIM41,3.6514084507042255,10.0,1420.0,Games and Society,"The study and critical analysis of computer games as art objects, cultural artifacts, gateways to virtual worlds, educational aids, and tools for persuasion and social change. Emphasis on understanding games in their historical and cultural context.",GDIM
GEN&SEX170,3.6595744680851063,4.0,94.0,"Topics in Gender, Feminism, Literature, and Language","Topics cover issues in language and literature which relate to women or gender, or which are taught from a feminist methodological perspective.",GEN&SEX
GEN&SEX171,3.685185185185185,3.0,54.0,"Topics in Gender, Feminism, and History","Topics cover issues in history which relate to women or gender, or which are taught from a feminist methodological perspective.",GEN&SEX
GERMAN150,3.581081081081081,4.0,74.0,German Literature and Culture in Translation,In English. Major works in Germanic literature and culture in context.,GERMAN
GERMAN1A,3.5466893039049237,32.0,589.0,Fundamentals of German,"Emphasizes the development of meaningful communicative skills in German for the purposes of interaction with German speakers and beginning study of German. With a learner-centered approach, the courses help students develop speaking, listening, reading, writing, and cultural skills and knowledge.",GERMAN
GERMAN1B,3.5428571428571427,17.0,315.0,Fundamentals of German,"Emphasizes the development of meaningful communicative skills in German for the purposes of interaction with German speakers and beginning study of German. With a learner-centered approach, students develop speaking, listening, reading, writing, and cultural skills and knowledge.",GERMAN
GERMAN1C,3.4696969696969697,11.0,198.0,Fundamentals of German,"Emphasizes the development of meaningful communicative skills in German for the purposes of interaction with German speakers and beginning study of German. With a learner-centered approach, students develop speaking, listening, reading, writing, and cultural skills and knowledge.",GERMAN
GERMAN2A,3.510948905109489,8.0,137.0,Intermediate German,"Emphasizes communicative skills for the purposes of interaction with German speakers and intermediate study of German. With a learner-centered approach, helps students develop reading, writing, speaking, listening, grammatical, and cultural skills and knowledge. First-year grammar is reviewed and expanded.",GERMAN
GERMAN2B,3.7023809523809526,5.0,84.0,Intermediate German,"Emphasizes communicative skills for the purposes of interaction with German speakers and intermediate study of German. With a learner-centered approach, helps students develop reading, writing, speaking, listening, grammatical, and cultural skills and knowledge. First-year grammar is reviewed and expanded.",GERMAN
GERMAN2C,3.6530612244897958,3.0,49.0,Intermediate German,"Emphasizes communicative skills for the purposes of interaction with German speakers and intermediate study of German. With a learner-centered approach, helps students develop reading, writing, speaking, listening, grammatical, and cultural skills and knowledge. First-year grammar is reviewed and expanded.",GERMAN
GLBLCLT191,3.42,3.0,50.0,Senior Seminar:Topics in Global Cultures,"Students explore a topic(s) concerning processes and/or problems of globalization from an interdisciplinary perspective and build on their critical and analytical skills when investigating cultural and other phenomena that cut across national borders. Research assignments, class presentations, final seminar paper.",GLBLCLT
GLBLME60A,3.689873417721519,5.0,158.0,Humanities and Arts: Problems and Methods for Global Middle East Studies,"Introduces students to the broad set of humanities and arts approaches to studying the Middle East as a global zone of cultural, political, and economic interaction.",GLBL ME
GLBLME60B,3.910891089108911,5.0,101.0,Social Sciences: Problems and Methods for Global Middle East Studies,"Introduces students to the broad set of social sciences approaches to studying the Middle East as a global zone of cultural, political, and economic interaction.",GLBL ME
GLBLME60C,3.8795180722891565,3.0,83.0,Social Ecology and Sciences: Problems and Methods for Global Middle East Studies,"Introduces students to the broad set of approaches to studying the Middle East as a global zone of cultural, political, and economic interaction, focusing on the disciplines related to Social Ecology.",GLBL ME
GREEK1A,3.433734939759036,5.0,83.0,Classical and Biblical Greek,"Elements of Classical Greek grammar, syntax, and vocabulary.",GREEK
HEBREW50,3.735294117647059,4.0,136.0,Jewish and Israeli Culture,"Examination of subjects relevant to the culture of Israel and Judaism in their historical and modern day contexts through the study of film, literature, religious texts, artistic representations, etc.",HEBREW
HUMAN10,3.0406091370558377,14.0,394.0,Masterpieces of Literature,"Students closely read major works of world literature that are significant (1) in their own right, (2) for a specific literary tradition, and (3) because of their reception in other cultural contexts. Literature written in English and English translation.",HUMAN
HUMAN1A,3.441152178401817,105.0,9686.0,Humanities Core Lecture,"Through a range of cultural traditions and an interdisciplinary approach to works of literature, history, philosophy, and contemporary media, students are introduced to the humanities.",HUMAN
HUMAN1AES,2.7957288765088206,63.0,1077.0,Humanities Core Writing: Entry Level Writing,"A small writing course for Entry Level Writing students exploring the ideas presented in the companion lecture course and illustrated in the literary, historical, philosophical, and media works assigned.",HUMAN
HUMAN1AS,3.270466321243523,269.0,4825.0,Humanities Core Writing,"A small writing course in which students explore the ideas presented in the companion lecture course and illustrated in the literary, historical, philosophical, and media works assigned.",HUMAN
HUMAN1B,3.5071832825424467,81.0,9188.0,Humanities Core Lecture,"Through a range of cultural traditions and an interdisciplinary approach to works of literature, history, philosophy, and contemporary media, students are introduced to the humanities.",HUMAN
HUMAN1BES,2.8354430379746836,9.0,158.0,Humanities Core Writing: Entry Level Writing,"A small writing course for Entry Level Writing students exploring the ideas presented in the companion lecture course and illustrated in the literary, historical, philosophical, and media works assigned.",HUMAN
HUMAN1BS,3.3042088438998403,309.0,5631.0,Humanities Core Writing,"A small writing course in which students explore the ideas presented in the companion lecture course and illustrated in the literary, historical, philosophical, and media works assigned.",HUMAN
HUMAN1C,3.523388712147991,65.0,8487.0,Humanities Core Lecture,"Through a range of cultural traditions and an interdisciplinary approach to works of literature, history, philosophy, and contemporary media, students are introduced to the humanities.",HUMAN
HUMAN1CS,3.3880541643479876,300.0,5391.0,Humanities Core Writing,"A small writing course in which students explore the ideas presented in the companion lecture course and illustrated in the literary, historical, philosophical, and media works assigned.",HUMAN
HUMAN55,3.2751677852348995,5.0,298.0,What is the Origin of Language?,Teaches symbol-based logic and universal grammar in human language as tools to investigate the origin of language. Does language originate with reason? Is language inherently universal or diverse? Does it begin as something literal or figurative.,HUMAN
HUMANB1A,3.5078125,4.0,128.0,Humanities Core Biological Sciences Lecture,"Through a range of cultural traditions and an interdisciplinary approach to works of literature, history, philosophy, and contemporary media, students are introduced to the humanities.",HUMAN
HUMANH120,3.966442953020134,9.0,149.0,Honors Proseminar ,"Interdisciplinary Honors courses organized each year around a single topic problem designed to compare and contrast modes of analysis in history, literary studies, and philosophy.",HUMAN
HUMANH1AS,3.6372250423011843,170.0,2955.0,Humanities Core Writing: Honors,"For Campuswide Honors students exploring the ideas presented in the companion lecture course and illustrated in the literary, historical, philosophical, and media works assigned.",HUMAN
HUMANH1BS,3.6717709720372835,171.0,3004.0,Humanities Core Writing: Honors,"For Campuswide Honors students exploring the ideas presented in the companion lecture course and illustrated in the literary, historical, philosophical, and media works assigned.",HUMAN
HUMANH1CS,3.7334331710969675,154.0,2671.0,Humanities Core Writing: Honors,"For Campuswide Honors students exploring the ideas presented in the companion lecture course and illustrated in the literary, historical, philosophical, and media works assigned.",HUMAN
HUMANH80,3.909090909090909,8.0,132.0,Exploring Memory,"Questions about human memory are central to a wide range of disciplines. Students will explore how historians, sociologists, social psychologists, legal experts, and neuroscientists understand human memory and apply their findings to understand and shape their own societies.",HUMAN
I&CSCI10,3.582492795389049,22.0,2776.0,How Computers Work,"Introduction to digital computer and communication systems. Capabilities and limitations of information technology. Representing information in digital form. Overview of computer organization, internet, operating systems, software. Human-computer interaction and social impact.",I&C SCI
I&CSCI139W,3.672872340425532,141.0,10528.0,Critical Writing on Information Technology,"Study and practice of critical writing and oral communication as it applies to information technology. Each student writes assignments of varying lengths, totaling at least 4,000 words.",I&C SCI
I&CSCI161,3.6729559748427674,7.0,795.0,Game Engine Lab,"The use of an open source game or graphics engine in the design and implementation of a computer game. Principles of game engine design. Students work on teams to design, implement, and evaluate new computer games based on an engine.",I&C SCI
I&CSCI162,3.5579567779960706,8.0,509.0,Modeling and World Building,"Use of 3D modeling software and related tools to design and create animated, textured models, and expansive virtual worlds incorporating objects, scenes, and venues for activity within game worlds and online environments.",I&C SCI
I&CSCI163,3.582608695652174,9.0,460.0,Mobile and Ubiquitous Games,"Design and technology of mobile games, including mixed reality gaming, urban games, and locative media. Case studies of significant systems. Uses and limitations of location-based technologies. Infrastructures and their relationships to gameplay and design.",I&C SCI
I&CSCI166,3.8126009693053313,10.0,619.0,Game Design,"Game design takes into consideration psychology, narrative, platform features and limitations, marketing, computer science capabilities, human-computer interface principles, industry trends, aesthetic judgment, and other factors. Students focus on video game design through lectures, readings, presentations, implementation, and play testing.",I&C SCI
I&CSCI167,3.515566625155666,10.0,803.0,Multiplayer Game Systems,"Foundations and technologies that enable multiuser, networked, and persistent virtual environments. Emphasis on database design and management, network protocols, and concurrency control to accommodate large numbers of simultaneous users.",I&C SCI
I&CSCI168,3.8205128205128207,9.0,507.0,Multiplayer Game Project,"Design and develop a multiplayer game using Unity or similar engine, with a focus on learning to work in a development team, writing design documents, working with platform features and limitations, developing engaging mechanics, playtesting, and post-mortems.",I&C SCI
