course_id,course_gpa,valid_sections,total_graded,title,description,department
CRM/LAWC145,3.5810473815461346,4.0,401.0,Government Crime,"Examines the legal, organizational, and political issues involved in the generation and control of government lawlessness. Readings present historical and theoretical perspectives in the abuse of government authority and the ability of the legal system to control such behavior.",CRM/LAW
CRM/LAWC149,2.8342205323193914,16.0,1315.0,Violence in Society,"Current theory and research on aggression; anger and violence as problems in individual and social functioning. Process and functions of anger examined with regard to normal behavior and psychopathology. The determinants, prevalence, and implications of violence in society are analyzed.",CRM/LAW
CRM/LAWC156,3.3496240601503757,5.0,266.0,Cross-Cultural Research on Urban Gangs,"Taking an urban policy approach, examines the background and contemporary traditions of gangs in several ethnic groups including African-, Asian-, and Mexican-Americans. Cross-cultural exploration of the varied facets of gang life. The major social-control institutions affecting them.",CRM/LAW
CRM/LAWC160,2.723158828748891,9.0,1127.0,Forensic Psychology ,Forensic psychology is the interface between clinical psychology and the law. Emphasizes clinically relevant legal topics (insanity defense; competency to stand trial) and includes critical thinking about issues that arise when psychologists are involved in legal proceedings.,CRM/LAW
CRM/LAWC162,3.4925178919973976,12.0,1537.0,Crime Hotspots,Criminological theories of local public safety hazards or hotspots are introduced. Spatial statistics are developed for different types of hotspots. Hotspot policing theories are introduced and research on the effectiveness of policing strategies is reviewed.,CRM/LAW
CRM/LAWC163,3.1577287066246056,3.0,317.0,Ethics and Politics of Justice,"Theoretical perspective on how ethics and politics relate to criminal justice through an introduction to moral philosophy; consideration of specific theories of punishment and justice; and consideration of practical and empirical illustrations of the intersection of ethics, politics, and justice.",CRM/LAW
CRM/LAWC164,3.6043405676126876,7.0,599.0,Social Control of Delinquency,"Assumes familiarity with theories of delinquency, the juvenile justice system, and elements of juvenile law. Explores socio-historical origins and evolution of juvenile justice, current research and policy on delinquency prevention and treatment, and future directions of law, policy, and practice.",CRM/LAW
CRM/LAWC165,3.0147783251231526,7.0,609.0,The Death Penalty,Examines why the U.S. continues to have a death penalty when so many other countries have abandoned it. Arguments for and against the death penalty are covered.,CRM/LAW
CRM/LAWC167,3.3266666666666667,14.0,1800.0,Crime Measurement,"The strengths and weaknesses of three crime measures (police reports, victim surveys, and offender self-reports) are illustrated through analyses of research articles. Common measurement problems are analyzed with a focus on reliability and validity.",CRM/LAW
CRM/LAWC168,3.871647509578544,5.0,522.0,Extreme Punishment ,"Explores the history and law of America’s Eighth Amendment prohibition against cruel and unusual punishment, examining the death penalty, long prison sentences, harsh confinement conditions, and other punishments. Students debate practical, legal, and moral arguments for and against these punishments.",CRM/LAW
CRM/LAWC173,3.3384615384615386,3.0,130.0,"Maritime Piracy, Law and Society","Explores the historical and contemporary images and reality of pirates and piracy since the 16th century across the globe through an analysis of primary sources, key historiographical and legal debates, and criminological theories.",CRM/LAW
CRM/LAWC174,3.011345218800648,6.0,617.0,Immigration and Crime,"Examines immigration and crime in the global context, highlighting immigrants as criminals and victims; immigration and crime control; immigrants’ perceptions of the criminal justice system; public discourse and public perception on immigration and crime; and human rights issues.",CRM/LAW
CRM/LAWC175,3.478962536023055,12.0,1735.0,Issues in Policing,"Lectures and readings focus on the history and strategies of policing, measuring the quality of policing, and police misconduct. Strategies for enhancing the quality of policing for controlling misconduct are covered.",CRM/LAW
CRM/LAWC176,3.4493597206053552,11.0,859.0,Classics in Crime Cinema,A multidimensional understanding of crime films and how they shape public thinking about crime and criminals.,CRM/LAW
CRM/LAWC177,3.2448979591836733,3.0,49.0,Eyewitness Testimony,"Faulty eyewitness testimony is a major cause of wrongful convictions. Covers the fast-growing topic of eyewitness testimony and memory for real-world events, both how psychologists study eyewitness capacity, and how the legal system has dealt with eyewitness issues.",CRM/LAW
CRM/LAWC178,3.743694060211554,12.0,1229.0,Critical Race Theory,"Introduction to Critical Race Theory and key American cases on racial inequality. Using this literature, examines the possibilities and pitfalls of legal claims of race, gender, and sexuality discrimination in the age of colorblindness.",CRM/LAW
CRM/LAWC180,3.2418032786885247,6.0,488.0,"Power, Constructions of Deviance, and Social Control ",Examines the forms and limits of power in the construction of social deviants. Theories of state power are covered to understand the prison system as a contemporary driver of social inequality. The collateral consequences of mass incarceration are discussed.,CRM/LAW
CRM/LAWC182,2.9014084507042255,4.0,142.0,Illegal Economics,"How illegal firms function in illegal markets, why individuals participate in these groups and markets, and what federal, state, and local governments do to disrupt organized illegal activity.",CRM/LAW
CRM/LAWC186,3.731034482758621,6.0,435.0,Social Media and The Law,"Examines legal and policy issues raised by the rise of social media. Surveys how social networking platforms and other emerging technologies impact the right to privacy, public perceptions of judicial systems, and the law generally.",CRM/LAW
CSE112,2.8772136953955134,16.0,847.0,Electronic Devices and Circuits,A first course in the design of Very Large Scale Integrated (VLSI) systems. Introduction to CMOS technology; MOS transistors and CMOS circuits. Analysis and synthesis of CMOS gates. Layout design techniques for building blocks and systems. Introduction to CAD tools.,CSE
CSE132,2.430894308943089,5.0,246.0,Organization of Digital Computers,"Building blocks and organization of digital computers, the arithmetic, control, and memory units, and input/out devices and interfaces. Microprogramming and microprocessors.",CSE
CSE132L,3.289772727272727,4.0,176.0,Organization of Digital Computers Laboratory,"Specification and implementation of a processor-based system using a hardware description language such as VHDL. Hands-on experience with design tools including simulation, synthesis, and evaluation using testbenches.",CSE
CSE135A,2.3615384615384616,4.0,130.0,Digital Signal Processing,"Nature of sampled data, sampling theorem, difference equations, data holds, z-transform, w-transform, digital filters, Butterworth and Chebychev filters, quantization effects.",CSE
CSE135B,3.0714285714285716,4.0,140.0,Digital Signal Processing Design and Laboratory,"Design and implementation of algorithms on a DSP processor and using computer simulation. Applications in signal and image processing, communications, radar, etc.",CSE
CSE141,2.68944099378882,5.0,161.0,Concepts in Programming Languages I,"In-depth study of several contemporary programming languages stressing variety in data structures, operations, notation, and control. Examination of different programming paradigms, such as logic programming, functional programming and object-oriented programming; implementation strategies, programming environments, and programming style.",CSE
CSE142,2.777027027027027,4.0,148.0,Compilers and Interpreters,"Introduction to the theory of programming language processors covering lexical analysis, syntax analysis, semantic analysis, intermediate representations, code generation, optimization, interpretation, and run-time support.",CSE
CSE145,3.863013698630137,3.0,73.0,Embedded Software,"Principles of embedded computing systems: embedded systems architecture, hardware/software components, system software and interfacing, real-time operating systems, hardware/software co-development, and communication issues. Examples of embedded computing in real-world application domains. Simple programming using an embedded systems development environment.",CSE
CSE161,2.8444444444444446,6.0,135.0,Design and Analysis of Algorithms,"Techniques for efficient algorithm design, including divide-and-conquer and dynamic programming, and time/space analysis. Fast algorithms for problems applicable to networks, computer games, and scientific computing, such as sorting, shortest paths, minimum spanning trees, network flow, and pattern matching.",CSE
CSE181A,3.802469135802469,3.0,81.0,Senior Design Project I,"Teaches problem definition, detailed design, integration, and testability with teams of students specifying, designing, building, and testing complex systems. Lectures include engineering values, discussions, and ethical ramifications of engineering decisions.   Materials fee.",CSE
CSE31,3.1986143187066975,10.0,433.0,Introduction to Digital Systems,"Digital representation of information. Specification, analysis, design and optimization or combinational and sequential logic, register-transfer components and register-transfer systems with datapaths and controllers. Introduction to high-level and algorithmic state-machines and custom processors.",CSE
CSE31L,3.1806615776081424,13.0,393.0,Introduction to Digital Logic Laboratory,"Introduction to common digital integrated circuits: gates, memory circuits, MSI components. Operating characteristics, specifications, applications. Design of simple combinational and sequential digital systems (arithmetic processors game-playing machines). Construction and debugging techniques using hardware description languages and CAD tools.  Materials fee.",CSE
CSE41,3.4019607843137254,10.0,408.0,Introduction to Programming,"Introduction to fundamental concepts and techniques for writing software in a high-level programming language. Covers the syntax and semantics of data types, expressions, exceptions, control structures, input/output, methods, classes, and pragmatics of programming.",CSE
CSE42,2.6972860125260962,12.0,479.0,Programming with Software Libraries,"Construction of programs for problems and computing environments more varied than in CSE41. Using library modules for applications such as graphics, sound, GUI, database, Web, and network programming. Language features beyond those in CSE41 are introduced as needed.",CSE
CSE43,3.1032258064516127,11.0,310.0,Intermediate Programming,"Intermediate-level language features and programming concepts for larger, more complex, higher-quality software. Functional programming, name spaces, modules, class protocols, inheritance, iterators, generators, operator overloading, reflection. Analysis of time and space efficiency.",CSE
CSE45C,3.2007575757575757,10.0,264.0,Programming in C/C++ as a Second Language,"An introduction to the lexical, syntactic, semantic, and pragmatic characteristics of the C/C++ languages for experienced programmers. Emphasis on object-oriented programming, using standard libraries, and programming with manual garbage collection.  Formerly ICS 65.",CSE
CSE46,2.724738675958188,10.0,287.0,Data Structure Implementation and Analysis,Focuses on implementation and mathematical analysis of fundamental data structures and algorithms. Covers storage allocation and memory management techniques.,CSE
CSE50,2.6201923076923075,4.0,208.0,Discrete-Time Signals and Systems,"Analysis of discrete-time linear-time-invariant (DTLTI) systems in the time domain and using z-transforms.  Introduction to techniques based on Discrete-Time, Discrete, and Fast Fourier Transforms. Examples of their application to digital signal processing and digital communications.",CSE
CSE70A,2.261146496815287,9.0,314.0,Network Analysis I,Modeling and analysis of electrical networks. Basic network theorems. Sinusoidal steady state and transient analysis of RLC networks and the impedance concept.,CSE
CSE90,3.8231827111984282,17.0,1018.0,Systems Engineering and Technical Communications ,"Introduces systems engineering concepts, including specifications and requirements, hardware and software design, integration, testing, and documentation. Emphasizes organization and writing of reports and effective presentations.",CSE
DANCE100,3.6576576576576576,12.0,444.0,Kinesiology for Dance,The study of the production of dance movement by the musculoskeletal system. Anatomical and dynamic analysis of dance movement.,DANCE
DANCE103,3.793846153846154,25.0,650.0,Pilates,"Basics of technique emphasizing alignment, breath control, correction of muscular imbalances.",DANCE
DANCE110,3.89010989010989,4.0,91.0,World Dance ,Studio workshop of dances and movement sources of specified countries or areas.,DANCE
DANCE132A,3.324519230769231,16.0,416.0,Studio Workshop in Ballet II,Intermediate ballet and beginning pointe work; principles of classical ballet with an emphasis on technique.,DANCE
DANCE132B,3.472772277227723,16.0,404.0,Studio Workshop in Ballet II,Intermediate ballet and beginning pointe work; principles of classical ballet with an emphasis on technique.,DANCE
DANCE132C,3.384105960264901,12.0,302.0,Studio Workshop in Ballet II,Intermediate ballet and beginning pointe work; principles of classical ballet with an emphasis on technique.,DANCE
DANCE133A,3.434589800443459,21.0,451.0,Advanced Studio Workshop in Ballet III,Advanced intermediate ballet and pointe work; principles of classical ballet with an emphasis on technique.,DANCE
DANCE133B,3.3746898263027294,18.0,403.0,Advanced Studio Workshop in Ballet III,Advanced intermediate ballet and pointe work; principles of classical ballet with an emphasis on technique.,DANCE
DANCE133C,3.3945205479452056,16.0,365.0,Advanced Studio Workshop in Ballet III,Advanced intermediate ballet and pointe work; principles of classical ballet with an emphasis on technique.,DANCE
DANCE134A,3.5390835579514826,12.0,371.0,Advanced Studio Workshop in Ballet IV,"Advanced ballet, pointe work, and performance styles: principles of classical ballet.",DANCE
DANCE134B,3.6097560975609757,12.0,328.0,Advanced Studio Workshop in Ballet IV,"Advanced ballet, pointe work, and performance styles: principles of classical ballet.",DANCE
DANCE134C,3.579124579124579,11.0,297.0,Advanced Studio Workshop in Ballet IV,"Advanced ballet, pointe work, and performance styles: principles of classical ballet.",DANCE
DANCE135A,3.876190476190476,6.0,105.0,Advanced Studio Workshop in Ballet V,"Advanced ballet, pointe work, and performance styles: principles of classical ballet.",DANCE
DANCE135B,3.8313253012048194,5.0,83.0,Advanced Studio Workshop in Ballet V,"Advanced ballet, pointe work, and performance styles: principles of classical ballet.",DANCE
DANCE135C,3.9375,4.0,64.0,Advanced Studio Workshop in Ballet V,"Advanced ballet, pointe work, and performance styles: principles of classical ballet.",DANCE
DANCE137,3.911042944785276,13.0,326.0,Repertory ,"Rehearsal and performance of repertoire from established ballet, modern, or jazz choreographers.",DANCE
DANCE139,3.946043165467626,12.0,278.0,Partnering,Principles of partnering techniques in various dance performance styles.,DANCE
DANCE142A,3.9225512528473803,12.0,439.0,Studio Workshop in Modern/Contemporary II,"Introduction to the principles of motion, including the use of breath, gravity, spatial awareness, and time values.",DANCE
DANCE142B,3.805755395683453,11.0,417.0,Studio Workshop in Modern/Contemporary II,"Introduction to the principles of motion, including the use of breath, gravity, spatial awareness, and time values.",DANCE
DANCE142C,3.824324324324324,11.0,370.0,Studio Workshop in Modern/Contemporary II,"Introduction to the principles of motion, including the use of breath, gravity, spatial awareness, and time values.",DANCE
DANCE143A,3.729658792650919,12.0,381.0,Advanced Studio Workshop in Modern/Contemporary III,Builds on fundamentals of Dance 142A-B-C and introduces performance techniques.,DANCE
DANCE143B,3.683195592286501,12.0,363.0,Advanced Studio Workshop in Modern/Contemporary III,Builds on the fundamentals of DANCE 142A-DANCE 142B-DANCE 142C and introduces performance techniques.,DANCE
DANCE143C,3.7306501547987616,11.0,323.0,Advanced Studio Workshop in Modern/Contemporary III,Builds on fundamentals of DANCE 142A-DANCE 142B-DANCE 142C and introduces performance techniques.,DANCE
DANCE144A,3.8622047244094486,11.0,254.0,Advanced Studio Workshop in Modern/Contemporary IV,Synthesis of fundamentals and performance technique. Aims to bring students to the preprofessional level.,DANCE
DANCE144B,3.795918367346939,7.0,147.0,Advanced Studio Workshop in Modern/Contemporary IV,Synthesis of fundamentals and performance technique. Aims to bring students to the preprofessional level.,DANCE
DANCE144C,3.855769230769231,5.0,104.0,Advanced Studio Workshop in Modern/Contemporary IV,Synthesis of fundamentals and performance technique. Aims to bring students to the preprofessional level.,DANCE
DANCE152A,3.6863753213367607,12.0,389.0,Intermediate Studio Workshop in Jazz II,Intermediate jazz: principles of jazz dance and contemporary forms incorporating the personal views of the instructor.,DANCE
DANCE152B,3.8120481927710843,14.0,415.0,Intermediate Studio Workshop in Jazz II,Intermediate jazz: principles of jazz dance and contemporary forms incorporating the personal views of the instructor.,DANCE
DANCE152C,3.8191489361702127,13.0,376.0,Intermediate Studio Workshop in Jazz II,Intermediate jazz: principles of jazz dance and contemporary forms incorporating the personal views of the instructor.,DANCE
DANCE153A,3.8167701863354035,11.0,322.0,Advanced Studio Workshop in Jazz III,Advanced jazz: principles of jazz dance and contemporary forms incorporating the personal views of the instructor.,DANCE
DANCE153B,3.7508196721311475,11.0,305.0,Advanced Studio Workshop in Jazz III,Advanced jazz: principles of jazz dance and contemporary forms incorporating the personal views of the instructor.,DANCE
DANCE153C,3.868217054263566,10.0,258.0,Advanced Studio Workshop in Jazz III,Advanced jazz: principles of jazz dance and contemporary forms incorporating the personal views of the instructor.,DANCE
DANCE155B,3.957894736842105,4.0,95.0,Studio Workshop in Hip Hop II,Introduction to learning outcomes in basic and foundational concepts of hip hop dance forms.,DANCE
DANCE160,3.9223300970873787,4.0,103.0,Improvisation,"Structured and experiential improvisation to heighten the personal intuitive processes, the kinesthetic sense, spatial and temporal awareness, and to encourage insights into the potential movement resources of the individual for performance and choreography. Course encourages freedom of exploration.",DANCE
DANCE163,3.971830985915493,8.0,142.0,Dance and Video Technology,"Introduction to video and audio documentation of dance performance. Integrating dance performance within the film aesthetic. Techniques and technologies of video cameras, formats, editing, and projection. Overview of video compression and DVD authoring.",DANCE
DANCE170,3.992857142857143,13.0,700.0,Dance Performance,"Rehearsal and performance as a principal dancer, part of the ensemble, or as an understudy in a faculty-choreographed production.",DANCE
DANCE171,3.9931129476584024,11.0,726.0,Dance Workshop,Rehearsal and performance in a student-choreographed production.,DANCE
DANCE172,3.9831223628691985,16.0,711.0,Master of Fine Arts Concert,"Rehearsal and performance as a principal dancer, part of the ensemble, or as an understudy in a graduate student-choreographed production.",DANCE
DANCE179,3.9849624060150375,8.0,133.0,UCI Etude Ensemble,"Repertory and performances by undergraduate Dance majors. Concert presentations on and off campus. Faculty directed, student/faculty choreographed.",DANCE
DANCE180C,3.9008746355685133,10.0,343.0,Laban Studies,Laban movement analysis.,DANCE
DANCE185W,3.831978319783198,18.0,369.0,Critical Issues in Dance,"Critical thinking and writing about dance, with a section on dance criticism and a major emphasis on persuasive writing about significant issues in the dance world.",DANCE
DANCE193,3.9565217391304346,47.0,1472.0,Selected Topics in Dance,Directed group studies of topics in dance.,DANCE
DANCE195,3.893939393939394,11.0,264.0,Arts Management,"Designed for students interested in the developmental and management of nonprofit arts organizations. Examines the organizational structure and areas of operation such as marketing, fundraising, budgeting, production, and administration.",DANCE
DANCE197,3.98989898989899,6.0,99.0,Independent Study,"Individual independent projects in experimental laboratory, library, field, performance, under instructor's direction. Students can receive conceptual, creative, and theoretical instruction in the successful completion of a written report or performance.",DANCE
DANCE2,3.844054580896686,12.0,513.0,Dance Health and Injury Prevention,An overview of factors that affect the health of dancers. Includes evaluation of general health measures and prevention and management of common dance injuries.,DANCE
DANCE21A,3.7450980392156863,19.0,459.0,Music for Dancers,"Emphasis on the development of musical skills most pertinent to the dancer: vocabulary, notational literacy, rhythmic and melodic acuity, score reading, and fundamental analysis; working with live accompaniment.",DANCE
EARTHSS1,2.9722222222222223,25.0,5868.0,Introduction to Earth System Science,"Covers the origin and evolution of the Earth, its atmosphere, and oceans, from the perspective of biogeochemical cycles, energy use, and human impacts on the Earth system.",EARTHSS
EARTHSS100,3.5,5.0,146.0,Special Topics in Earth System Science,Devoted to current topics in the field of Earth System Science. Topics addressed vary each quarter.,EARTHSS
EARTHSS112,3.6589147286821704,8.0,258.0,Global Climate Change and Impacts,"Observations over the 20th century show extensive changes in atmospheric composition, climate and weather, and biological systems that have paralleled industrial growth. Evidence of globally driven changes in these biogeochemical systems is studied, including projected impacts over the 21st century.",EARTHSS
EARTHSS114,3.3714285714285714,17.0,630.0,Earth System Science Laboratory and Field Methods,"Introduction to methods used to measure exchange of gases and energy between the atmosphere and terrestrial ecosystems. Laboratories include data acquisition and isotopic and chromatographic analysis. Field measurements at UCI's Marsh Reserve include microclimate, hydrology, trace-gas exchange, and plant growth. Materials Fee",EARTHSS
EARTHSS115,3.506172839506173,4.0,81.0,Aquatic Field Methods,"Students design sampling plans, conduct field research techniques, and carry out data analyses that are relevant to aquatic field research. Aquatic field sites covered in the course include marine, estuarine, and fluvial systems. Materials Fee",EARTHSS
EARTHSS116,3.110371075166508,23.0,1051.0,Introduction to Environmental Data Science,"Analysis and interpretation of geophysical data, including functional fitting, probability density functions, and multidimensional time-series methods, with applications in atmospheric, oceanic, and biogeochemical sciences.",EARTHSS
EARTHSS118,3.4657534246575343,7.0,146.0,"Analysis, Modeling, and Visualization of Multidimensionnal Environmental Data","Students learn programming and numerical methods in Python with applications in Earth System Science and ecology. Topics include regression, uncertainty and significance, the development of simple box models, and the visualization of multi-dimensional climate and satellite datasets.",EARTHSS
EARTHSS124,3.371584699453552,6.0,183.0,Weather Analysis,Provides an overview of weather systems in midlatitudes and tropics. The fundamental dynamics possible for these weather systems are described. Elementary weather analysis and forecasting techniques are introduced.,EARTHSS
EARTHSS132,3.350684931506849,10.0,365.0,Terrestrial Hydrology,"Comprehensive treatment of modern conceptual and methodological approaches to hydrological science. Combines qualitative understanding of hydrological processes with quantitative representation, approaches to measurement, and treatment of uncertainty. Components of the hydrological cycle and their linkages within the coupled Earth system.",EARTHSS
EARTHSS134,3.4566326530612246,12.0,392.0,Fundamentals of GIS for Environmental Science,"Introduction to Geographic Information Systems (GIS). Topics include fundamentals of cartography, creating/editing GIS data, linking spatial and tabular data, georeferencing, map projections, geospatial analysis, spatial statistics, and the development of GIS models. Examples from hydrology, ecology, and geology.",EARTHSS
EARTHSS138,3.4913793103448274,8.0,232.0,Satellite Remote Sensing for Earth System Science,"Satellite remote sensing data are increasingly used to study the Earth system. Provides an overview of the principles behind remote sensing, and the types of satellite data available for study of the oceans, land, and atmosphere.",EARTHSS
EARTHSS140,3.3607594936708862,7.0,158.0,Advanced Geology,"Introduces students to the geological processes which have formed and continue to shape the Earth. Topics include geological time, minerals and the rock cycle, plate tectonics and associated geological hazards, earth resources, and earth surface processes. Materials Fee",EARTHSS
