course_id,course_gpa,valid_sections,total_graded,title,description,department,difficulty_score,difficulty_tier
PUBHLTH173,3.764378478664193,6.0,539.0,Health and Global Environmental Change ,"Examines global environmental and climate change's impact on human health. Explores metabolic pandemics, infectious diseases, and underlying health conditions. Fosters interdisciplinary collaboration among environmental health, public health, medicine, and policy sciences.",PUBHLTH,2.017091160253578,easy
FLM&MDA190,3.3807615230460923,16.0,499.0,Special Topics in Film and Modern Media,"Special issues concerned with film and media history, theory, and criticism.",FLM&MDA,3.6906486535132865,medium
ART154,3.875,4.0,72.0,Advanced Studio Topics: Performance,"An intensive investigation of the practice of performance art, with an emphasis on the development of individual projects, and the refinement of various technical skills, as well as audiences, spaces, and cultural connections.",ART,1.5344965480080466,easy
ENGRMAE106,3.5121681415929205,19.0,3616.0,Mechanical Systems Laboratory,"Experiments in linear systems, including op-amp circuits, vibrations, and control systems. Emphasis on demonstrating that mathematical models can be useful tools for the analysis and design of electro-mechanical systems. Materials Fee",ENGRMAE,3.117377509179676,medium
MATH112B,2.911417322834646,12.0,508.0,Introduction to Partial Differential Equations and Applications II,"Introduction to partial differential equations and their applications in engineering and science. Basic methods for classical PDEs (potential, heat, and wave equations). Green functions and integral representations, method of characteristics.",MATH,5.738197625680744,hard
EDUC15,3.2907801418439715,26.0,1269.0,Statistics for Education Research ,"Provides an introduction to the use of statistics in educational research. Focuses on testing and measurement, and provides basic tools to read, interpret, and draw conclusions from quantitative educational research.",EDUC,4.083199119699099,medium
PSCI141H,3.087912087912088,4.0,182.0,Clinical Health Psychology,"Behavioral role in etiology, treatment, and prevention of certain diseases. Behavioral intervention including biofeedback, stress-, pain-management, health habit counseling, and other skills to assist patients make cognitive, emotional, and behavioral changes needed to cope with disease or achieve better health.",PSCI,4.968226089515078,hard
ART109,3.9018567639257298,20.0,377.0,Performance and the Camera,"Surveys the development of contemporary artists who use performance strategies in the making of videos and films. Students analyze the artist's conceptual approach to performative gestures, actions, and landscapes created for their video or film art.",ART,1.417331918409773,easy
ASIANAM114,3.684931506849315,3.0,73.0,Topics in Asian American Film and Video,"Topics include histories of Asian American film and video, including documentaries, experimental, short subjects, feature-length independent film, and other forms of cinematic expression. Explores issues of identity (national, racial, gendered, among others).",ASIANAM,2.3636844821867866,medium
HUMAN55,3.2751677852348995,5.0,298.0,What is the Origin of Language?,Teaches symbol-based logic and universal grammar in human language as tools to investigate the origin of language. Does language originate with reason? Is language inherently universal or diverse? Does it begin as something literal or figurative.,HUMAN,4.151309186284807,medium
PUBHLTH115,3.8097014925373136,5.0,268.0,"Community, Social Justice, and Health Equity Research for Action","Focuses on community as a unit of identity, community, well-being, and social justice perspectives and initiatives to promote community health. Addresses community change and improvements in community well-being, with a focus on health equity research for action.",PUBHLTH,1.819366142175947,easy
ENGRMAE118,3.64375,8.0,480.0,Sustainable Energy Systems,"Basic principles, design, and operation of sustainable energy systems including wind, solar photo-voltaic and thermal, hydroelectric, geothermal, oceanic, biomass combustion, advanced coal, and next generation nuclear. Includes power generation, storage, and transmission for stationary power generation.",ENGRMAE,2.5433418679255144,medium
DANCE197,3.98989898989899,6.0,99.0,Independent Study,"Individual independent projects in experimental laboratory, library, field, performance, under instructor's direction. Students can receive conceptual, creative, and theoretical instruction in the successful completion of a written report or performance.",DANCE,1.0332411610984662,easy
SOCSCI170A,3.253968253968254,10.0,252.0,Research Methods in the Social Sciences,"Examines how interdisciplinary social science research questions are formulated and studies several research methods including: experimental method, quasi-experimental methods, survey research, field research, evaluation research, and meta-analysis. Parametric and non-parametric statistical methods are illustrated using the SPSS program.",SOC SCI,4.243793717756372,medium
CLASSIC170,3.506849315068493,8.0,146.0,Topics in Classical Civilization,Studies in selected areas of Classical civilization. Topics addressed vary each quarter.,CLASSIC,3.140581285381283,medium
COMPSCI199,3.9751809720785936,39.0,967.0,Individual Study,Individual research or investigation with Computer Science faculty.,COMPSCI,1.0974496082187641,easy
JAPANSE1C,3.1575520833333335,41.0,768.0,Fundamental Japanese,"Students develop listening, speaking, reading, and writing abilities in Japanese for meaningful communication. Content deals with daily life, society, and culture in Japan. Approximately 180 kanji (Chinese characters) are introduced in addition to the hiragana and katakana orthography.",JAPANSE,4.664416431310549,medium
FRENCH101B,3.5,3.0,48.0,Introduction to 18th-Century French Literature,Literature and philosophy of the 18th century studied in relationship to a specific literary or historical problem.,FRENCH,3.1704619316579934,medium
ENGRMAE135,2.9014084507042255,9.0,1136.0,Compressible Flow,"Compressibility effects in fluid mechanics. One-dimensional flow with area variation, friction, heat transfer, and shocks. Design of gas supply systems. Two-dimensional flow with oblique shocks and isentropic waves. Supersonic airfoil theory and design, wind tunnel design. Basic diagnostics.",ENGRMAE,5.781862074573401,hard
SPANISH190,3.7964601769911503,11.0,226.0,Colloquium,"Specialized, discussion-based course dealing primarily with a research topic that reflects the instructor's current intellectual interests. Required oral presentation(s) and final research paper. Limited to 15 students.",SPANISH,1.8771323658226375,easy
DANCE135C,3.9375,4.0,64.0,Advanced Studio Workshop in Ballet V,"Advanced ballet, pointe work, and performance styles: principles of classical ballet.",DANCE,1.2618356507330555,easy
MGMT166,3.8772635814889336,7.0,497.0,Business of Medicine,"In order to improve the quality and efficiency of health care delivery one must understand the design and management of health care operations. Opportunities for innovation and changes needed to design a simple, accessible, fair, and effective health care system.",MGMT,1.5246215054508037,easy
EDUC125,3.60977501939488,18.0,1289.0,"Children, Schools, and Cinema","Through popular films, analyzes aspects of school dynamics and interaction of schools with students, teachers, and public. Melding educational studies and film studies provides deeper understanding of methods used to transmit information and attitudes about schools to the lay public.",EDUC,2.6915602470725934,medium
BIOSCI56,3.743529411764706,7.0,425.0,Life Sciencing from Aristotle to Venter,"History of biology from Aristotle through to the scientific revolutions precipitated by Darwin, geneticists, molecular biologists, and now genomics. Introduces the practices and achievements of biological research to both beginning biology students and non-majors.",BIO SCI,2.108046764864145,easy
ANTHRO141A,3.232415902140673,12.0,327.0,Ancient Civilization of Mexico and the Southwest,"The prehistory and cultural evolution of the civilization which originated in Mexico, including the Olmecs, Aztecs, Toltecs, Maya, and Zapotec, as well as the Pueblos of the Southwestern U.S. Topics include the origins of food production and of the state.",ANTHRO,4.337817455159485,medium
EECS159B,3.943695479777954,15.0,2522.0,Senior Design Project II,"Teaches problem definition, detailed design, integration, and testability with teams of students specifying, designing, building, and testing complex systems. Lectures include engineering values, discussions, and ethical ramifications of engineering decisions. Materials Fee",EECS,1.2348074095281585,easy
ART30B,3.961414790996785,17.0,311.0,Basic Painting II,"Further examinations of the essential qualities of painting: color, form, space, surface, scale, and content. Studio work, slide presentations, and critiques of student work. Materials Fee",ART,1.157505596791819,easy
UNISTU84,3.850382741823243,21.0,1437.0,Bridges to University Success,"Helps first-year students transition to UC Irvine and promotes a successful University experience. Students learn about academic resources/programs that support acclimation to the campus and enhance academic development through lectures, writing laboratories, discussions, and a range of co-curricular activities.",UNI STU,1.6418911672548413,easy
FLM&MDA130,3.4459770114942527,45.0,1305.0,Multicultural Topics in the Media,"Investigation of media representations of gender, race, and sexuality in the United States. Topics include media images of and by one or more minority groups in the United States, including African Americans, Asian Americans, Chicano/Latinos, Native Americans, gays, and lesbians.",FLM&MDA,3.406141235969251,medium
PHYSICS14,3.3457943925233646,11.0,321.0,Energy and the Environment,"The physics of society’s energy production and consumption, and of their influences on the environment. Topics include fossil and renewable energy resources; nuclear power; prospects for a hydrogen economy; efficient and environmentally benign transportation; efficient home and commercial energy usage.",PHYSICS,3.8431953604486253,medium
MGMT124,3.665791201575838,25.0,1523.0,Human Resources Management,"Theory and practice of managing human resources. Students identify and analyze HR dilemmas, apply labor law, and design systems and processes to develop the human resources needed to help organizations achieve their goals.",MGMT,2.4471854871465237,medium
UPPP115,3.699300699300699,10.0,1001.0,Global Poverty and Inequality in the 21st Century,"Explores a multidisciplinary understanding of poverty and inequality in the 21st century and assesses impact of education, health, technology, and other interventions. Course offered online only.",UPPP,2.300997811676204,medium
DANCE179,3.9849624060150375,8.0,133.0,UCI Etude Ensemble,"Repertory and performances by undergraduate Dance majors. Concert presentations on and off campus. Faculty directed, student/faculty choreographed.",DANCE,1.0547773753588146,easy
CHINESE1MC,3.5384615384615383,8.0,156.0,Fundamentals of Mandarin Chinese - Mandarin Background Track,"Natural approach emphasizing four fundamental skills: listening, speaking, reading and writing. Specifically designed for students with previous background in Mandarin Chinese. Conducted in Mandarin Chinese using the Pinyin system of Romanization, traditional and simplified Chinese characters.",CHINESE,3.0026706102579994,medium
ANTHRO134C,3.3666666666666667,3.0,450.0,"Medicine, Food, and Health","With anthropological studies of edible things as its foundation, this course explores topics related to the relationship between medical knowledge, eating, and health from a medical anthropological perspective.",ANTHRO,3.752138512511308,medium
MATH150,2.603938730853392,12.0,457.0,Introduction to Mathematical Logic,First order logic through the Completeness Theorem for predicate logic.,MATH,7.079595846200098,hard
SOCIOL173,3.4568744662681468,19.0,1171.0,Social Inequality,"Sources, functions, and dynamics of the unequal distribution of wealth, prestige, knowledge, and power in American and other societies.",SOCIOL,3.3586002792226335,medium
I&CSCI166,3.8126009693053313,10.0,619.0,Game Design,"Game design takes into consideration psychology, narrative, platform features and limitations, marketing, computer science capabilities, human-computer interface principles, industry trends, aesthetic judgment, and other factors. Students focus on video game design through lectures, readings, presentations, implementation, and play testing.",I&C SCI,1.8067169591808159,easy
BIOSCI47,3.384259259259259,7.0,648.0,Stress,"Investigates stress at a psychological, physiological, and molecular level, and provides a current overview of the field of stress research.",BIO SCI,3.6753895192042743,medium
GERMAN1A,3.5466893039049237,32.0,589.0,Fundamentals of German,"Emphasizes the development of meaningful communicative skills in German for the purposes of interaction with German speakers and beginning study of German. With a learner-centered approach, the courses help students develop speaking, listening, reading, writing, and cultural skills and knowledge.",GERMAN,2.9667763717242135,medium
DANCE153B,3.750819672131147,11.0,305.0,Advanced Studio Workshop in Jazz III,Advanced jazz: principles of jazz dance and contemporary forms incorporating the personal views of the instructor.,DANCE,2.076242461938031,easy
I&CSCI32,2.8588606347328995,60.0,10146.0,Programming with Software Libraries,"Construction of programs for problems and computing environments more varied than in I&C SCI 31. Using library modules for applications such as graphics, sound, GUI, database, Web, and network programming. Language features beyond those in I&C SCI 31 are introduced as needed.",I&C SCI,5.967480085450728,hard
MATH133C,3.2240437158469946,5.0,183.0,Statistical Methods with Applications to Finance,"Overview of interest theory, time value of money, annuities/cash flows with payments that are not contingent, loans, sinking funds, bonds, general cash flow and portfolios, immunization, duration and convexity, swaps.",MATH,4.374341740391287,medium
KOREAN1B,3.507897934386391,40.0,823.0,Fundamental Korean,"Natural approach with emphasis on the four fundamental skills of listening, speaking, reading, and writing for students with no previous background in Korean. Conducted in both English and Korean.",KOREAN,3.136006605635395,medium
ECON123B,3.3175853018372705,12.0,762.0,Econometrics II,"Specification, estimation, and testing of econometric models. Applications in various areas of microeconomics and macroeconomics.",ECON,3.966259616093138,medium
ENGLISH106,3.5584652862362973,86.0,1642.0,Advanced Seminar: Topics in English Literature ,"Capstone course. Provides intensive work on a topic within the area of literatures in English with particular attention to the theoretical, critical, or conceptual issues it raises, with the goal of producing a substantive research paper.",ENGLISH,2.915402773183945,medium
EDUC132,3.627027027027027,11.0,370.0,Reading and Writing Enrichment for After-School Programs,Examines literacy development and the implementation of research-based practices to enrich learners' reading and writing skills in after-school programs. A minimum of 20 hours of after-school program fieldwork is required in order to design and implement literacy enrichment activities.,EDUC,2.616297080980175,medium
CBE120C,2.4936708860759493,6.0,316.0,Mass Transfer,"Molecular and continuum approaches to diffusion and convection in multi-component mixtures; steady state, quasi-steady state and transient mass transfer; effect of reactions on mass transfer; convective mass transfer; simultaneous mass, heat and momentum transfer; applications to chemical and related industries.",CBE,7.560647518161649,hard
EECS180B,3.0096153846153846,8.0,208.0,Engineering Electromagnetics II,"Time-varying electromagnetic fields, plane waves, polarization, guidance of waves like rectangular waveguides and microstrips, optical fibers resonant cavities, skin effects and losses, spherical waves, radiation and reception of waves, antenna basics.",EECS,5.309801279507925,hard
PERSIAN50,3.943661971830986,8.0,284.0,Topics in Persian Culture,"Study of varied topics in Persian culture, area studies, and society, both in the present and in historical perspective. Topics are not normally repeated for a two-year period.",PERSIAN,1.2349535904383377,easy
SOCIOL135,2.950127877237852,13.0,782.0,Social Psychology of Networks,"Review of network methods used in small group and organizational research. Discussion of social psychological literature relevant to the network of study of cognitive social structure, exchange/communication, identity negotiation, and social control. Case study of network datasets exemplifies research issues.",SOCIOL,5.569319953719297,hard
HUMANB1A,3.5078125,4.0,128.0,Humanities Core Biological Sciences Lecture,"Through a range of cultural traditions and an interdisciplinary approach to works of literature, history, philosophy, and contemporary media, students are introduced to the humanities.",HUMAN,3.13637931949862,medium
LPSH125,3.856,6.0,125.0,What Is Time? ,"Engages the question ""what is time?"" by drawing on physics, philosophy, fiction, film, and psychology. Organized around understanding and addressing the tension between time as represented in physics and our immediate temporal experience.",LPS,1.6173854607796445,easy
ARTHIS151C,3.0672268907563027,4.0,119.0,Modern China,"Examines the evolution and media of Chinese art and visual culture in the context of modern China's sweeping historical, social, and political changes.",ART HIS,5.058466800183982,hard
PSCI166S,3.7744565217391304,4.0,368.0,Chicano/Latino Families,"Introduction to the research, literature, and issues surrounding the topic of Chicano/Latino families including cultural history, contemporary issues, organization of family, traditions, lifestyles, values, beliefs, generational differences, gender issues, ethnic identity, evolution of demographic patterns, current economic and political standings.",PSCI,1.973124947972163,easy
EASIAN190,3.2734375,7.0,128.0,Junior-Senior Colloquium,Specialized courses dealing with primary sources; required reports and papers. Each colloquium reflects the instructor's intellectual interest and is conducted as a discussion group. Limited to 15 students.,E ASIAN,4.158857684279837,medium
FLM&MDA85A,3.165625,30.0,4160.0,Introduction to Film and Visual Analysis,"Introduces the language and techniques of visual and film analysis. Teaches students to analyze the moving image; emphasize framing, camera movement, and sound; and conveys how editing produces meaning, reproduces historical ideologies, fosters or disrupts narrative, and cues spectators.",FLM&MDA,4.629197732079197,medium
I&CSCI168,3.8205128205128207,9.0,507.0,Multiplayer Game Project,"Design and develop a multiplayer game using Unity or similar engine, with a focus on learning to work in a development team, writing design documents, working with platform features and limitations, developing engaging mechanics, playtesting, and post-mortems.",I&C SCI,1.7722009199913713,easy
LINGUIS2,3.385490753911806,10.0,703.0,Discovering Language,"Explores language's pervasiveness and diversity; demonstrates ways linguistics illuminates language's crucial--albeit hidden--societal role. Issues: self-and group-identification, language death, language in legal and educational settings. Illustrations: spoken and signed languages, varieties of English, Native American languages.",LINGUIS,3.6700170322130288,medium
PSCI169C,3.832046332046332,3.0,518.0,Psychosis,"Describes the origins, development, assessment, neurological correlates, and treatment of psychosis spectrum disorders. Emphasis is placed on early onset, early identification, and early psychosocial interventions of the disorders.",PSCI,1.7218851183360337,easy
PUBHLTH180,3.3947175348495966,12.0,1363.0,Epidemiology of Infectious Disease,"Explores the distribution of infectious disease and disease risks among human populations. Covers concepts and methods of infectious disease epidemiology, including case studies of important infectious diseases such as COVID-19, HIV, and malaria.",PUBHLTH,3.6297645143017054,medium
FLM&MDA185,3.452887537993921,10.0,329.0,Topics in Television and New Media,"Advanced seminar focusing on special topics in television and new media. Past examples have included courses on media marketing and brand identity; television and sound; game theory; and other issues related to popular culture, broadcast media, and new media technologies.",FLM&MDA,3.3759935502725766,medium
PSYCH160D,3.3085988651244,18.0,2291.0,Brain Disorders and Behavior,"Examines the localization of human brain functions and the effects of neurological disorders on psychological functions such as perception, motor control, language, memory, and decision-making.",PSYCH,4.0054636144521165,medium
ENGRMAE183,3.995893223819302,7.0,487.0,Computer-Aided Mechanism Design,"Focuses on design of planar, spherical, and spatial mechanisms using computer algebra and graphics. Topics include exact and approximate analytical design techniques. Students are required to use existing software (or develop new algorithms) to design various mechanisms for new applications.",ENGRMAE,1.0070908699114516,easy
EECS188,2.877887788778878,10.0,606.0,Optical Electronics,"Photodiodes and optical detection, photometry and radiometry, geometric optics, lens theory, imaging system, EM wave propagation, optical waveguides and fibers, heterojunction structures, laser theory, semiconductor lasers, and optical transmission system.",EECS,5.884472711134473,hard
EECS163,3.125,7.0,208.0,Power Systems,"Generation, transmission, and use of electrical energy. Fault calculation, protection, stability, and power flow.",EECS,4.806427315307941,medium
CSE42,2.697286012526096,12.0,479.0,Programming with Software Libraries,"Construction of programs for problems and computing environments more varied than in CSE41. Using library modules for applications such as graphics, sound, GUI, database, Web, and network programming. Language features beyond those in CSE41 are introduced as needed.",CSE,6.672361388935125,hard
CBEMS149B,3.647761194029851,5.0,335.0,Chemical Engineering Design II,"Application of chemical engineering basics to practical design problems; process economics; process safety; environmental impacts; a major team design project with progress reports, oral presentation, and technical report with engineering drawings and economics.",CBEMS,2.5258427357123425,medium
ART150F,3.786127167630058,6.0,173.0,Advanced Figure Drawing,Students develop technical skills in rendering the figure. Live model sessions and an introduction to anatomy. Investigates use of the figure in contemporary art. Materials fee.,ART,1.9222108874857795,easy
CSE135A,2.3615384615384616,4.0,130.0,Digital Signal Processing,"Nature of sampled data, sampling theorem, difference equations, data holds, z-transform, w-transform, digital filters, Butterworth and Chebychev filters, quantization effects.",CSE,8.137085045097832,hard
CRM/LAWC107,3.6597938144329896,18.0,2134.0,Deviance,"Perspectives on deviance and criminality in behavior, institution, community, and myth. The suitability of contemporary theories of deviant behavior.",CRM/LAW,2.473349534501316,medium
BIOSCI93,2.927033913196275,81.0,22764.0,From DNA to Organisms,"Cell biology, biochemistry, genetics, and the biology of organ systems. Covers concepts of building blocks (nucleotides, amino acids, and cells) and of information flow (DNA to proteins, receptors to nuclei, the blood to distant organs, and DNA to offspring).",BIO SCI,5.670069089034701,hard
LATIN100,3.5135135135135136,4.0,74.0,Topics in Classical Latin,"Selected readings in Classical Latin prose and poetry. Authors may include Cicero, Caesar, Ovid, Catullus, and others. Selections from prose and poetry will be read each quarter. Grammar and syntax review included.",LATIN,3.1115082241390764,medium
RUSSIAN150,3.523465703971119,11.0,277.0,Topics in Russian Literature,"Examines major themes in Russian literature, film, and other media from the eighteenth to twenty-first centuries. Taught in English.",RUSSIAN,3.068091053258719,medium
MGMT173,3.6573849878934626,10.0,826.0,Business Intelligence for Analytical Decisions,"BI from both managerial and technical perspectives. Learn to apply a variety of data mining techniques to learn business intelligence embedded in data, and apply that intelligence to run your business more efficiently. These techniques are useful in different areas.",MGMT,2.4838582193916716,medium
SOCSCI193A,3.236162361623616,11.0,271.0,Field Studies in Social Policy and Public Service,"Advanced training in qualitative and ethnographic research centered on community service. Students pursue field studies at nonprofit agencies (200 hours) to understand current social problems in underrepresented and underserved communities. Through field placement, students apply theory to practice.",SOC SCI,4.321473247091905,medium
ECON131A,2.7687150837988828,11.0,895.0,The Economics of Risk and Uncertainty,The theory of insurance and joint-ownership of risky enterprises; optimal procedures for the allocation of uncertain payoffs.,ECON,6.360746754299008,hard
ART123B,3.926174496644295,7.0,298.0,"Issues in Media, Violence, and Fear","Violence has been instrumental in story-telling throughout history in art, literature, religion, and entertainment. Continuing presence of media violence provoked debates among parents, politicians, media producers, and academics. Examines history, theory, aesthetics, economics, and politics of violent representation.",ART,1.3112440012459743,easy
