course_id,course_gpa,valid_sections,total_graded,title,description,department,difficulty_score,difficulty_tier
CBE181,3.4814814814814814,3.0,81.0,Polymer Science and Engineering,"An introduction to physical aspects of polymers, including configuration and conformation of polymer chains and characterization techniques; crystallinity, viscoelasticity, mechanical properties, polymer alloys, processing, and application.",CBE,3.2512503456653983,medium
MGMT102,3.4739672131147543,69.0,7625.0,Managing Organizational Behavior,"Basic theory and concepts which provide the manager with tools for understanding behavior of people in organizations. Areas such as individual, group, and organizational determinants of attitudes, turnover, and job performance.",MGMT,3.284031900149189,medium
ENGRCEE130L,3.675041876046901,64.0,1194.0,Soil Mechanics Laboratory,Laboratory procedures of soil testing for engineering problems. Materials Fee,ENGRCEE,2.406828731919661,medium
DANCE152C,3.8191489361702127,13.0,376.0,Intermediate Studio Workshop in Jazz II,Intermediate jazz: principles of jazz dance and contemporary forms incorporating the personal views of the instructor.,DANCE,1.7781509668495286,easy
BIOSCI193A,3.9565217391304346,6.0,115.0,Campus as a Living Lab I,"Students study sustainability concepts and theories and how they apply to our most pressing environmental, social, and economic challenges. Concurrently, they work on hands-on projects to improve the sustainability of campus operations and systems.",BIO SCI,1.1788518993884938,easy
I&CSCI51,3.0810272304626967,46.0,9034.0,Introductory Computer Organization,"Multilevel view, design, and operation of computer system components. Machine-level data and instruction representation. Instruction sets and addressing modes. Memory organization. Laboratory work using low-level programming languages.",I&C SCI,4.998261792071261,hard
ENGRMAE189,3.904040404040404,124.0,3762.0,Senior Project - Special Topics,Group or individual senior project of theoretical or applied nature involving design.,ENGRMAE,1.4078056260418894,easy
ECON157,3.382910260993922,12.0,2797.0,Economic Development,"Considers the process of economic development across the globe and why some countries are rich and others poor. Discusses the major problems facing developing countries, such as population growth, education, capital formation, environmental protection, and international trade.",ECON,3.6812746244434624,medium
EDUC185,3.2576419213973797,5.0,229.0,Social Development in Education,"Examination of contextual, psychosocial, and biological factors contributing to the social development of children and adolescents. Theoretical perspectives, empirical findings, and methodological issues are emphasized. Implications of the scientific evidence for practical and policy decision-making surrounding development are discussed.",EDUC,4.227767070436126,medium
EASIAN40,3.4148471615720526,6.0,229.0,Topics in East Asian Popular Culture,Selected topics in the popular cultural traditions of East Asia designed to introduce students both to problems in situating culture in a specific time and place and to contemporary theories of popular culture and their application to East Asian contexts.,E ASIAN,3.5419475209584177,medium
UPPP100,3.545736434108527,28.0,1290.0,Special Topics in Urban Studies,Course content varies with interest of the instructor.,UPPP,2.970933337062961,medium
ANTHRO121J,3.3533834586466167,10.0,266.0,Urban Anthropology,"Cultural roles of cities and the processes of urbanization in a comparative perspective. Focus includes nonwestern, nonindustrial societies of past and present; the relationship between modern urban centers across different world regions. Themes covered include: inequality, race, migration, poverty, capitalism.",ANTHRO,3.810087495190303,medium
ARTHIS55,3.815742397137746,4.0,559.0,Disneyland,"From Dole Whips to roller coasters, the focus is on the innovations in industrial automation and manufacturing that made Disneyland’s attractions possible. Discusses fandom, guest experiences, operating procedures, technical and design patents, and how rides work.",ART HIS,1.7930122466766427,easy
PSCI127D,3.375366568914956,4.0,1023.0,Attachment Relationships,"Students learn about the development of attachment-related needs throughout development, as well as the links between attachment and emotion, psychopathology and treatment. Lectures emphasize classic as well as cutting-edge research and are supplemented by primary source readings.",PSCI,3.7141845420597353,medium
UPPP145,3.668831168831169,5.0,462.0,Environmental Governance,"How should the environment be managed and who should be responsible? What is effective environmental management, and for whom? These questions are answered by exploring traditional and emerging theoretical frameworks and applying them to real world environmental challenges.",UPPP,2.433923403954121,medium
HUMAN1AS,3.270466321243523,269.0,4825.0,Humanities Core Writing,"A small writing course in which students explore the ideas presented in the companion lecture course and illustrated in the literary, historical, philosophical, and media works assigned.",HUMAN,4.1718196725311225,medium
INTLST11,3.515848214285714,55.0,4480.0,Global Cultures and Society,"Offers a general overview of the rise of global interdependence in political, economic, demographic, and cultural terms. Considers what drove people from relative isolation into intensified intercourse with one another, and investigates the consequences of this shift.",INTL ST,3.101322918420407,medium
UPPP133,3.552469135802469,5.0,324.0,Environmental Law and Policy ,"Environmental law as a combination of traditional legal principles and newly created statutes, rules, and decisions applied to environmental protection. Investigates roles of courts, legislature, executive branch and administrative agencies, and private citizens attempting to regulate environmental quality.",UPPP,2.9415614253036804,medium
BIOSCID105,3.085526315789474,5.0,304.0,"Cell, Developmental, and Molecular Biology of Plants","Emphasizes the special features of plant cells and plant development as compared to animals. Two central topics: plants' ability to fuel our planet through photosynthesis, and the interactions of plants with microorganisms in making nitrogen available to other life forms.",BIO SCI,4.978634197797408,hard
MGMT126,3.7295742232451095,15.0,869.0,Foundations of Teams,Social and psychological processes that detract from effective teamwork and collaboration. Tools to understand how to be a better team member are introduced. Provides the foundation for students to become effective team leaders and to manage difficult team situations.,MGMT,2.1689273124384627,easy
INTLST142D,3.4122448979591837,6.0,245.0,The International Relations of East Asia,"Surveys various aspects of relations between the nations of East Asia. Topics include the historical development of the region; current political and security relations, including the impact of the American military presence.",INTL ST,3.5533000894645115,medium
UPPP112,2.8157248157248156,9.0,407.0,Foundations of Community Health,"A social ecological framework for understanding community health is presented. Measures of individual and community health are compared, and the influence of personal and environmental factors on individual, group, and population health is examined. Community health promotion strategies are discussed.",UPPP,6.155663303297701,hard
PSYCH131A,3.5622641509433963,7.0,265.0,Vision,Visual perception and the anatomy and physiology of the visual system. Topics include the retina and the visual pathway; visual sensitivity; color vision; spatial vision; motion perception; and the development of the visual system.,PSYCH,2.8988299434293228,medium
ECON142A,2.7936046511627906,9.0,688.0,Industrial Organization I,"The theory of market structure. Imperfect markets, government policies, and industry performance.",ECON,6.252164165975336,hard
BIOSCI97,2.8744514870794733,76.0,20510.0,Genetics,"Introduction to genetics. Basic features of replication and expression of DNA, cell division, and gene transmission. Recombination and mutation in diploid organisms.",BIO SCI,5.899463832809149,hard
CHC/LAT178A,3.5255474452554743,6.0,137.0,Medical Anthropology,"Introduces students to cross-cultural perspectives and critical theories in anthropological studies of medicine. Special attention is given to diverse ways of understanding bodies, illnesses, and therapeutic practices in our changing world.",CHC/LAT,3.0590093021149323,medium
DANCE170,3.992857142857143,13.0,700.0,Dance Performance,"Rehearsal and performance as a principal dancer, part of the ensemble, or as an understudy in a faculty-choreographed production.",DANCE,1.0203359988609204,easy
SOCECOL195CW,3.947019867549669,8.0,151.0,Advanced Field Study,"While completing 8 hours per week of field work, students write and finalize their AFS Client Project in consultation with the placement and the FS instructor, and make a final written and oral presentation to the placement and invited guests.",SOCECOL,1.2203045206845462,easy
PSYCH140L,2.879548306148055,9.0,797.0,Learning and Decision Making,"The psychological and neural bases of learning about and interacting with the world. Topics include shaping of behavior by rewards and punishments, abstraction of relational information, goal-directed versus habitual decision strategies, social knowledge transmission, and behavioral and substance addictions.",PSYCH,5.877228580641344,hard
PSYCH114M,3.365811965811966,7.0,585.0,MATLAB Programming,"MATLAB is a mathematical software package for solving quantitative problems often encountered in experimental psychology. Topics include rudiments of programming, statistical analysis of data, matrix algebra, signal processing, graphic visualization, and simulated models of cognitive and perceptual processes.",PSYCH,3.755867208542419,medium
EARTHSS138,3.4913793103448274,8.0,232.0,Satellite Remote Sensing for Earth System Science,"Satellite remote sensing data are increasingly used to study the Earth system. Provides an overview of the principles behind remote sensing, and the types of satellite data available for study of the oceans, land, and atmosphere.",EARTHSS,3.2080703312821313,medium
LPSH95,3.732394366197183,4.0,71.0,Jurisprudence and Constitutional Law,"Applies competing theories of the nature of law and legal reasoning to evaluate decisions of the U.S. Supreme Court in controversial areas of constitutional law such as free speech, privacy, sexual conduct, affirmative action, and political campaign contributions.",LPS,2.1566242291143647,easy
DANCE137,3.911042944785276,13.0,326.0,Repertory ,"Rehearsal and performance of repertoire from established ballet, modern, or jazz choreographers.",DANCE,1.3772565213586658,easy
BIOSCI198,3.994871794871795,10.0,390.0,Directed Group Studies,Small group experimental laboratory or field work performed under the direction of a faculty member.,BIO SCI,1.0115469296447301,easy
PHYSICS125A,3.4876543209876543,12.0,648.0,Mathematical Physics,Complex variables; Legendre and Bessel functions; complete sets of orthogonal functions; partial differential equations; integral equations; calculus of variations; coordinate transformations; special functions and series.,PHYSICS,3.2243208743295972,medium
MSE165B,3.379032258064516,4.0,124.0,Diffusion and Heat Transport in Materials,"Examines how kinetics affect materials development, behavior, and processing. Highlights the ways in which kinetics and diffusion are key to designing materials processing and heat treating strategies, with examples in various applied topics.",MSE,3.698192700577332,medium
ANTHRO121D,3.283783783783784,7.0,222.0,Cross-Cultural Studies of Gender,"Explores the construction of gender in national and transnational contexts. Special attention is given to how race, sexuality, class, and global inequalities shape different experiences of gender, and how gender structures political, institutional, and social life across the world.",ANTHRO,4.113721251960664,medium
MATH105B,3.2823275862068964,21.0,928.0,Numerical Analysis II,Introduction to the theory and practice of numerical computation with an emphasis on topics from calculus and approximation theory. Lagrange interpolation; Gaussian quadrature; Fourier series and transforms; Methods from data science including least squares and L1 regression.,MATH,4.120074022167447,medium
UPPP166,3.543123543123543,8.0,858.0,Urban Politics and Policy ,Examines why and how urban policies are enacted and carried out in contemporary U.S. cities and regions. Topics include evolution and organization of city governments and policymaking over the past century; who directs public policy and controls how cities develop.,UPPP,2.982332268270121,medium
EAS130,3.3632075471698113,10.0,212.0,Topics in Korean Society and Culture,"Studies of the social and cultural forces that affect the lives of the Koreans, including those in the United States. Considers traditional values and contemporary issues within a historical framework.",EAS,3.767229178524012,medium
EDUC134,3.4880212954747116,22.0,1127.0,Teaching English Internationally,"Covers methods of teaching English as a foreign language, basic language knowledge for English teachers, the social context of English language teaching around the world, and essential information about securing international employment as an English teacher.",EDUC,3.2227199208429074,medium
PSYCH112BW,3.705357142857143,8.0,336.0,Advanced Experimental Psychology,"Design and analysis of multivalent, factorial, and correlational studies. Students prepare proposals for independent research.",PSYCH,2.27457612632588,medium
ITALIAN2B,3.5584415584415585,8.0,154.0,Intermediate Italian,"Second quarter of second-year Italian in a hybrid or fully online format. Students are taught to conceptualize in Italian as they learn to understand, read, write, and speak. Classes are conducted entirely in Italian.",ITALIAN,2.915506287452807,medium
PSYCH140M,3.4915466499686914,11.0,3194.0,Human Memory,"Developments in the area of memory; history of memory research; theories of the nature of memory. Visual memory, recognition memory, high-speed scanning, free recall, short-term memory, mnemonics, retrieval, relationship of memory to thinking. Selected theoretical formulations for memory.",PSYCH,3.2073402997302525,medium
I&CSCI46,2.849458088893308,51.0,10057.0,Data Structure Implementation and Analysis,Focuses on implementation and mathematical analysis of fundamental data structures and algorithms. Covers storage allocation and memory management techniques.,I&C SCI,6.0084993908154045,hard
SPANISH123,3.634920634920635,3.0,63.0,Topics in 20th and 21st Century Spanish Literature and Culture,"20th century Spanish authors. Works of poetry, narrative, or theater. Historical context of the period and principles of literary theory.",SPANISH,2.5818606296040443,medium
CHC/LAT129,3.441666666666667,8.0,240.0,"Special Topics in Literature, Arts, Media, Culture",Studies in selected areas of Chicano/Latino Studies. Topics addressed vary each quarter.,CHC/LAT,3.4249454357813174,medium
ENGRCEE164,3.3430232558139537,7.0,172.0,Carbon and Energy Footprint Analysis,"Process design for wastewater treatment. Mass- and energy-balance analysis applied to water and wastewater treatment systems. Case studies include analysis of water supply, treatment, reclamation, and reuse.",ENGRCEE,3.85528465039518,medium
PSYCH112C,3.8260869565217392,8.0,207.0,Research in Experimental Psychology,Each student conducts a research project in experimental psychology. The projects are discussed in a seminar format. Written reports on each project are submitted at the end of the quarter.,PSYCH,1.7478833371797782,easy
BME50B,2.891744548286604,18.0,1284.0,Cell and Molecular Engineering,"Physiological function from a cellular, molecular, and biophysical perspective. Introduction to genetics, structure and function of cells and tissues, cell cycle control, cancer, and immunology.",BME,5.824021567443267,hard
ANTHRO134A,3.629930966469428,25.0,4056.0,Medical Anthropology,"Introduces students to cross-cultural perspectives and critical theories in anthropological studies of medicine. Special attention is given to diverse ways of understanding bodies, illnesses, and therapeutic practices in our changing world.",ANTHRO,2.6036284292362177,medium
SOCIOL1,3.525173456680306,93.0,22484.0,Introduction to Sociology,"Considers major sociological concepts, theories, and research findings illuminating processes of interpersonal interaction, social differentiation and stratification, integration and conflict, and change, with attention to variation in class, race/ethnic, gender, multicultural, and cross-national perspectives and experiences.",SOCIOL,3.0606408550825472,medium
CRM/LAWC178,3.743694060211554,12.0,1229.0,Critical Race Theory,"Introduction to Critical Race Theory and key American cases on racial inequality. Using this literature, examines the possibilities and pitfalls of legal claims of race, gender, and sexuality discrimination in the age of colorblindness.",CRM/LAW,2.107328473772105,easy
UPPP101,3.586206896551724,7.0,609.0,History of Cities,"Surveys the global and historical co-evolution of cities and social institutions, including religion, the economy, governance, the arts, technology, and family life.",UPPP,2.7943779354166263,medium
CBE100,3.112759643916914,5.0,337.0,Introduction to Numerical Methods in Engineering,"An introduction to the fundamentals of numerical analysis and the computer algorithms in MATLAB for the solution of engineering problems, with emphasis on problems arising in chemical engineering thermodynamics, transport phenomena, and reaction engineering.",CBE,4.859826778869214,medium
ANTHRO139,3.643546971027217,62.0,2278.0,Special Topics in Cultural and Psychological Anthropology,Studies in selected areas of Cultural and Psychological Anthropology. Topics addressed vary each quarter.,ANTHRO,2.544227596915783,medium
ENGLISH105,3.6278443113772454,103.0,3340.0,Multicultural Topics in Literatures in English,"Focuses on ethnic or minority literatures, or treats issues related to race and cultural identity.",ENGLISH,2.612731617232024,medium
LATIN1B,3.5762711864406778,3.0,59.0,Fundamentals of Latin,"Elements of Latin grammar, syntax, and vocabulary.",LATIN,2.8377232095597003,medium
DANCE133C,3.3945205479452056,16.0,365.0,Advanced Studio Workshop in Ballet III,Advanced intermediate ballet and pointe work; principles of classical ballet with an emphasis on technique.,DANCE,3.6306238843193475,medium
PUBHLTH127,3.338516746411483,11.0,836.0,Public Health Programs for the Corporate World,"International perspective on workplace health promotion. Strategies for developing programs to improve employee health and to decrease risks of chronic degenerative diseases. Case studies include assessment of employee health, program design, implementation, and evaluation. Emphasis on disease prevention.",PUBHLTH,3.874944632751273,medium
UPPP142,3.658536585365854,4.0,410.0,Environmental Hazards in an Urbanizing World,"Development patterns, including urbanization, can contribute to environmental hazard severity. Humans can plan, mitigate, and prepare to reduce costly hazard losses. Students learn about environmental hazards and human response to these threats.",UPPP,2.478834289789723,medium
EDUC191,3.657407407407407,8.0,216.0,Advanced Fieldwork in After-School Education,Capstone fieldwork experience for students seeking to earn the Department of Education-sponsored Certificate in After-School Education. Students are required to complete 50 or more hours of fieldwork and related assignments at an instructor-approved after-school program.,EDUC,2.4837604125950543,medium
SOCSCI120,3.6083333333333334,31.0,3600.0,Transnational Gangs,"Examines the internationalization of U.S. domestic street gangs. The relationship between California gangs Mara Salvatrucha and 18th Street and Mexico/Central American gangs is assessed. Specified topics include: mobilization, migration, territorialism, culture, organization, and use of technology.",SOC SCI,2.697849709714675,medium
EDUC10,3.4304100568692006,30.0,3341.0,Educational Research Design,"Designed to help students become intelligent consumers of research and independent researchers, and provides an introduction to the basic principles of educational research. Topics include research questions, literature reviews, and qualitative and quantitative research designs.",EDUC,3.474053233023743,medium
UPPP172,3.578761061946903,9.0,565.0,Latino Metropolis,"Explores the processes of Latino urbanization in the United States and the spatialization of Latino identities, particularly in the context of Southern California with selected comparisons drawing from other cities.",UPPP,2.826860942525615,medium
MUSIC16C,3.142857142857143,10.0,294.0,Music Theory,"Tonicization and modulation to closely related keys. Simple binary and ternary forms. Voice-leading reductions and simple forms. Diatonic sequence with seventh chords. Introduction to chromatic harmony I: modal exchange and mixture chords, the Neapolitan and augmented sixth chords.",MUSIC,4.7285242018008,medium
MGMT149,3.5734177215189873,11.0,790.0,Derivatives,"Introduction to financial derivatives. Covers forward contracts, futures, swaps, and options. Applications of these instruments, including pricing and risk management, are emphasized.",MGMT,2.8501716624539535,medium
PSYCH130A,3.1742243436754176,15.0,1257.0,Perception and Sensory Processes,"A general introduction to the scientific study of sensory processes and perceptual phonomena, with special emphasis in the visual systems.",PSYCH,4.59168245587895,medium
PSCI183S,3.7278481012658222,13.0,632.0,Social Epidemiology,"Overviews evidence linking environmental factors to mental and physical disorders including such variables as socioeconomic status, income inequality, work stress, job loss, social capital, location, and other demographic characteristics. Measurement and research design issues of both individual and aggregate levels.",PSCI,2.1764576479213193,easy
SOCIOL174,3.306258322237017,19.0,751.0,"Protests, Movements, and Revolutions","A survey of models of collective action drawn from sociology, economics, psychology, and political science. Focus on areas such as social movements, strikes, crowd psychology, cults, fads, fashions, public opinion, and symbolic and mythical elements in collective culture.",SOCIOL,4.015674406832667,medium
ENGRCEE169,3.121739130434783,5.0,115.0,Environmental Microbiology for Engineers,"Fundamental and applied principles of microbiology. Structures and functions of microorganisms, the microbiology of water, wastewater and soil used in environmental engineering, and the impact of microorganisms on human and environmental health.",ENGRCEE,4.820653101252722,medium
BIOSCI23,3.869565217391304,3.0,69.0,Sustainable Landscaping: Design and Practices,"Through lectures and hands-on work, students learn how to design habitats around dwellings, within cities, and in rural environments. These include traditional/sustainable landscaping, restoration, stormwater/wastewater treatment, xeriscaping, and low impact development design. Sustainable landscape plant materials emphasized.",BIO SCI,1.5582061912493508,easy
I&CSCI4,3.4501510574018126,8.0,993.0,Designing Computing Technology for People,"Introduces students to basic principles of human-centered computing and theories of human behavior that are relevant for the design of technology for people. Specific topics include usability, prototyping, heuristic evaluation, visual design, theory of perception, accessibility.",I&C SCI,3.3879316503304944,medium
MGMT7,3.055692729766804,33.0,3645.0,Statistics for Business Decision Making,"Basics of data analysis and the fundamental notion of statistical inference emphasizing applications to administrative and management decision problems. Classical estimation and hypotheses testing, regression, correlation, analysis of variance, nonparametric methods, and statistical probability.",MGMT,5.108785435139357,hard
ENGRMAE115,2.6515837104072397,22.0,3094.0,Applied Engineering Thermodynamics,"Application of thermodynamic principles to compressible and incompressible processes representative of practical engineering problems; power cycles, refrigeration cycles, multicomponent mixtures, air conditioning systems, combustion, and compressible flow. Design of a thermodynamic process.",ENGRMAE,6.871741080187285,hard
WRITING90,3.927835051546392,12.0,194.0,Intermediate Poetry Writing,"Intermediate workshop in the writing of poetry, evaluation of student manuscripts, and parallel readings.",WRITING,1.303999707012692,easy
FLM&MDA144,3.529933481152993,14.0,451.0,Studies in New Media,"Advanced analysis of the technologies, texts, theories, and cultures of computers, video games, networks, or platforms.",FLM&MDA,3.0398748943821667,medium
GERMAN1B,3.5428571428571427,17.0,315.0,Fundamentals of German,"Emphasizes the development of meaningful communicative skills in German for the purposes of interaction with German speakers and beginning study of German. With a learner-centered approach, students develop speaking, listening, reading, writing, and cultural skills and knowledge.",GERMAN,2.983494459240857,medium
BIOSCI192,3.9968051118210863,44.0,939.0,Topics in Biological Sciences Tutoring ,Tutoring programs with biological sciences student peers.,BIO SCI,1.003112690698958,easy
SOCSCI10A,2.7940129449838187,57.0,6180.0,Probability and Statistics in Social Sciences I,Introduction to the variety of statistical applications in the social sciences. Descriptive statistics. Measures of central tendency and dispersion. Percentile ranks. Standardization and normal approximation. Basic probability theory focuses on application to statistical inference and binomial distribution. Laboratory required.,SOC SCI,6.250382953821842,hard
