course_id,course_gpa,valid_sections,total_graded,title,description,department,difficulty_score,difficulty_tier
ECON155,3.1370967741935485,4.0,124.0,Current Issues in Political Economy,"Political economy seeks explanations that combine insights from both economics and politics. Topics include the interaction of government and markets, the causes of the Great Recession, and the sources of income and wealth inequality.",ECON,4.753654238416006,medium
AFAM40A,3.618006103763988,18.0,1966.0,African American Studies I,Discusses main contours of African American experience from the forced importation of Africans into the Americas in the late fifteenth century to the development of social movements in post-emancipation societies of the late nineteenth and twentieth centuries.,AFAM,2.6556515294785594,medium
CBEMS128,2.9285714285714284,3.0,182.0,Introduction to Numerical Methods in Engineering,"An introduction to the fundamentals of numerical analysis and the computer algorithms in MATLAB for the solution of engineering problems, with emphasis on problems arising in chemical engineering thermodynamics, transport phenomena, and reaction engineering.",CBEMS,5.663361563886485,hard
ENGRCEE172,2.8110599078341014,10.0,217.0,Groundwater Hydrology,"Topics include conservation of fluid mass, storage properties of porous media, matrix compressibility, boundary conditions, flow nets, well hydraulics, groundwater chemistry, and solute transport. Design projects and computer applications included.",ENGRCEE,6.176014310836698,hard
ANTHRO132A,3.55,7.0,180.0,Psychological Anthropology,"Cultural differences and similarities in personality and behavior. Child-rearing practices and consequent adult personality characteristics, biocultural aspects of child development and attachment, culture and behavior evolutionary models, politically linked personality, cognitive anthropology, psychology of narrative forms, comparative national character studies.",ANTHRO,2.9523332138380014,medium
CHINESE1MA,3.4193548387096775,4.0,62.0,Fundamentals of Mandarin Chinese - Mandarin Background Track,"Natural approach emphasizing four fundamental skills: listening, speaking, reading and writing. Specifically designed for students with previous background in Mandarin Chinese. Conducted in Mandarin Chinese using the Pinyin system of Romanization, traditional and simplified Chinese characters.",CHINESE,3.5222824442708847,medium
ECON100A,2.9260458603185717,65.0,11426.0,Intermediate Economics I,"Determinants of supply and demand; operation of competitive and monopolistic markets; imperfections of the market system, explanations of unemployment, inflation, recessions; public policy for macroeconomic problems.",ECON,5.674379543181735,hard
ANTHRO169,3.546276595744681,43.0,1880.0,Special Topics in Area Studies,Studies in selected areas of Anthropology. Topics addressed vary each quarter.,ANTHRO,2.9685768417607656,medium
PHYSICS112B,2.7207678883071553,11.0,573.0,Electromagnetic Theory,"Electric, magnetic, and gravitational fields and potentials; electrodynamics; mechanical and electromagnetic waves and radiation.",PHYSICS,6.569919959812508,hard
ARTHIS150,3.3422619047619047,13.0,336.0,Studies in Asian Art,"Topics include visual studies in China, Japan, Korea and India.",ART HIS,3.858606100971067,medium
CLASSIC36B,3.485530546623794,12.0,1244.0,The Formation of Ancient Greek Society: Late Archaic and Classical Greece,"A survey of ancient Greek civilization from the Late Archaic period to the Classical period. Focuses on major institutions and cultural phenomena as seen through the study of ancient Greek literature, history, archaeology, and religion.",CLASSIC,3.233585997908153,medium
ART101W,3.868501529051988,29.0,654.0,Artists as Writers,"Contemporary art practice involves text, as final form or an integral element. Many contemporary artists consider writing as essential to their practice. Covers historical and contemporary uses of text and image as well as artists' writing.",ART,1.5628466107216523,easy
INTLST16,3.7752675386444703,15.0,841.0,Human Rights and Global Governance,"Historical development of civil, political rights and the rise of human rights in international law. Explores role, and limitations, of the UN, ICJ, and ICC in global governance. Reconceptualizing democracy and political representation in a postnational 21st century.",INTL ST,1.9695868264183205,easy
BME148,3.6979166666666665,6.0,192.0,Microimplants,"Essential concepts of biomedical implants at the micro scale. Design, fabrication, and applications of several microimplantable devices including cochlear, retinal, neural, and muscular implants.",BME,2.3070357569538555,medium
ARTHIS40B,3.254957507082153,12.0,1765.0,Arts of Europe: Medieval and Renaissance,"Focuses on the art of the Mediterranean area and Europe between ca. A.D. 350 and 1600. By means of movements and artists, examines the cultural identities of the Christian, Islamic, and Early Modern worlds.",ART HIS,4.239478027489688,medium
LITJRN101BW,3.7167019027484143,29.0,473.0,Literary Journalism Core Writing Workshop,"Writing workshops in announced specialized genres that students will both study and practice. Examples include ""The Memoir,"" ""Review Writing,"" ""The Editorial,"" ""Writing Biography,"" ""The Profile,"" and ""Political Writing.""",LIT JRN,2.2250837677447053,easy
INTLST145A,3.3164893617021276,15.0,376.0,International Law,"Examination of the origin, changing structure, application of international law, and the role of legal norms in regulating the behavior of states and maintaining international order.",INTL ST,3.9710407364228617,medium
ENGRCEE156,2.5286624203821657,10.0,314.0,Foundation Design,"Applications of soil mechanics principles to the analysis and design of shallow foundations, retaining walls, pile foundations, and braced cuts. Design criteria: bearing capacity, working loads and tolerable settlements, structural integrity of the foundation element. Damage from construction operations.",ENGRCEE,7.407994347906263,hard
ART144,3.7183098591549295,6.0,142.0,Artist Books as Objects,"Are artist books still relevant in the contemporary creative community? Focusing on intellectual content and raw physicality, students will explore this question and image/text relationships by creating handmade one-of-a-kind or edition book projects utilizing various mechanical reproduction techniques.",ART,2.2180689383594334,easy
ENGRCEE21,3.101010101010101,11.0,1287.0,Computational Problem Solving,"Engineering analysis and problem solving using MATLAB (or similar), including matrix algebra, solving systems of linear and nonlinear equations, numerical integration of ordinary differential equations (ODEs) and coupled ODEs, and analysis of numerical errors.",ENGRCEE,4.911085033453896,medium
PUBHLTH189,3.5443262411347516,6.0,564.0,Special Topics in Infectious Diseases,Studies in selected areas of infectious diseases. Topics addressed vary each quarter.,PUBHLTH,2.9770854087679295,medium
MGMT151,3.71404958677686,14.0,1210.0,Marketing Research,"Research to aid managerial decisions for products and services; problem formulation, research design, data collection, sampling, statistical analyses, managerial recommendations, and implementation in several real-world settings.",MGMT,2.236654693387277,easy
MATH130C,3.107011070110701,15.0,542.0,Stochastic Processes,"Markov chains, Brownian motion, Gaussian processes, applications to option pricing and Markov chain Monte Carlo methods.",MATH,4.884905359542071,medium
ANTHRO163A,2.9023746701846966,9.0,379.0,Peoples of the Pacific,"The cultural history and recent developments among the Pacific peoples of Polynesia, Micronesia, Melanesia, New Guinea, and Australia.",ANTHRO,5.777646870245244,hard
PSYCH160A,3.253019707565162,17.0,1573.0,Introduction to Cognitive Neuroscience,"Introduction to the neural basis of human perceptual, motor, and cognitive abilities. Topics include sensory perception, motor control, memory, language, attention, emotion, frontal lobe function, functional brain imaging, and neuropsychological disorders.",PSYCH,4.247931821970355,medium
EARTHSS148,3.491279069767442,10.0,344.0,Marine Ecosystems and Global Change,"Presents an overview of marine ecosystem structure, diversity, and processes in the context of global change, including the impacts of climate warming, ocean acidification, marine fisheries, and anthropogenic additions of nutrients and pollutants.",EARTHSS,3.208507638254503,medium
CBE120A,2.9054726368159205,7.0,402.0,Momentum Transfer,"Fluid statics, surface tension, Newton's law of viscosity, non-Newtonian and complex flows, momentum equations, laminar and turbulent flow, velocity profiles, flow in pipes and around objects, piping systems design, pumps and mixing, and other applications to chemical and related industries.",CBE,5.764131760462885,hard
PUBHLTH158,3.06,4.0,300.0,Sociology of Mental Health,"Examines the social causes, consequences, and patterns of mental health and illness. Students learn a sociological perspective on mental health, mental illness or disorder, and medicine/health care, ranging from social definitions, roles, and interactions to societal stratification and international patterns.",PUBHLTH,5.089994648473931,hard
PERSIAN1C,3.9375,3.0,48.0,Fundamentals in Persian,"Designed for students with little or no exposure to Persian. Students learn the modern writing system and grammar of Persian. Facilitates basic reading, writing, and speaking skills and fosters college-level literacy in Persian culture.",PERSIAN,1.2618356507330555,easy
PHYSICS20D,3.2260711030082043,10.0,1097.0,Space Science,"Space exploration. Human missions to the moon, Mars, and beyond. Space stations, observatories, and deep-space probes. Robots and drones on distant worlds. Propulsion mechanisms, rockets, space flight, and the dangers of solar radiation.",PHYSICS,4.365497113151299,medium
INTLST13,2.715258855585831,35.0,1468.0,Global Economy,Acquaints students with the fundamental patterns of the global economy. Emphasizes the historical roots and political implications of economic choices.,INTL ST,6.593953524691125,hard
EARTHSS180,3.4988179669030735,5.0,423.0,Environmental Sustainability I,"Provides an introduction to sustainability from different points of view; historical, scientific, political, ethical, and economic.",EARTHSS,3.1756186389350614,medium
MATH107,3.0375,4.0,80.0,Numerical Differential Equations,Theory and applications of numerical methods to initial and boundary-value problems for ordinary and partial differential equations.,MATH,5.188152571492928,hard
PHYSICS20E,3.3731629392971247,21.0,3130.0,Life in the Universe,"An overview of the scientific quest to discover life elsewhere in the universe. Topics include the origin of life on Earth, Mars, extra-solar planets, interstellar travel, and extra-terrestrial intelligence.",PHYSICS,3.7237980401214896,medium
ECON140E,3.2535211267605635,3.0,71.0,Health Economics,"Builds off of economic theory to explore topics in health economics including health care demand, health insurance markets, the supply of health care, and examine health care policy.",ECON,4.245744343446691,medium
DANCE132B,3.472772277227723,16.0,404.0,Studio Workshop in Ballet II,Intermediate ballet and beginning pointe work; principles of classical ballet with an emphasis on technique.,DANCE,3.2892448968074937,medium
ITALIAN150,3.472049689440994,8.0,161.0,Topics in Italian Literature and Culture,"Major themes, periods, and/or movements in Italian literature and culture. Taught in English.",ITALIAN,3.292397239756126,medium
ENGRCEE151A,2.382623224728488,12.0,1197.0,Structural Analysis,Fundamentals of structural analysis and loading. Deformation of statically determinate and indeterminate structures. Influence lines. Structural systems.,ENGRCEE,8.04510119789426,hard
PUBHLTH126,3.7828054298642537,8.0,663.0,Public Health Law: Fundamentals in Action,"Addresses the relationship of U.S. public health law to health systems at the individual and population levels. Examines legislative and judicial concepts and how they are applied to disease prevention strategies, health services, management, and policy.",PUBHLTH,1.9367022154815614,easy
I&CSCI61,3.524609843937575,8.0,833.0,Game Design Fundamentals,Explore the fundamentals of game design through the design and play of simple analog game systems. Students explore the principles and usage of game design elements through hands-on projects emphasizing iteration and playtesting in a creative game design community.,I&C SCI,3.0630996575809273,medium
MATH195W,3.4545454545454546,12.0,209.0,Mathematical Writing,"Techniques of mathematical writing and communication. Covers effectively writing mathematical papers, creating effective presentations, and communicating mathematics in a variety of media. Focuses on utilizing LaTeX for typesetting mathematics.",MATH,3.3687607660398053,medium
ART121B,3.728155339805826,5.0,103.0,Afro-Futurism II,"Second of a two-part course on the futuristic artistic visions of Black film, video, and cyberspace. Deals with modern techno-culture, digital activism, and designing technology based on African aesthetic principles of contemporary Hip Hop International Culture.",ART,2.175117296945402,easy
MATH176,3.181540808543097,21.0,1311.0,Mathematics of Finance,"After reviewing tools from probability, statistics, and elementary differential and partial differential equations, concepts such as hedging, arbitrage, Puts, Calls, the design of portfolios, the derivation and solution of the Blac-Scholes, and other equations are discussed.",MATH,4.559763833867711,medium
ARTHIS103,3.4,6.0,140.0,Studies in Greek Art,"Topics in Greek art, architecture, and topography from the Prehistoric period through the end of the fourth century B.C.E.",ART HIS,3.60671936729798,medium
EDUC145,3.861723446893788,11.0,499.0,Theories and Pedagogies of Race in Education,Introduces theoretical frameworks to examine the role of race in American education. Emphasis is placed on introducing students to different race and ethnicity paradigms.,EDUC,1.592416498130587,easy
SOCIOL173W,3.298245614035088,5.0,171.0,Social Inequality,"Sources, functions, and dynamics of the unequal distribution of wealth, prestige, knowledge, and power in American and other societies.",SOCIOL,4.050630442159717,medium
PUBHLTH120,3.680247550283651,10.0,1939.0,Nutrition and Global Health,"Global issues related to nutrition and public health. Evaluation of nutritional risk factors associated with the development of chronic diseases and the role of nutritional medicine in prevention. Topics include food safety, communicable diseases, supplements, and regulatory issues.",PUBHLTH,2.384118590986643,medium
BIOSCID132,3.4652956298200515,12.0,1167.0,Introduction to Precision Medicine,"Introduction to the use of genomic techniques for the study of individual genomes and transcriptomes in healthy and diseased samples. Covers GWAS, current sequencing techniques, cancer genomics, and biomarker discovery.",BIO SCI,3.3218623270600447,medium
CHC/LAT102W,3.429718875502008,11.0,249.0,Chicano/Latino Research Seminar,"Taught as a writing and research seminar in Chicano/Latino Studies. Student develops own project; engages in peer editing; drafts, writes, and presents paper at Spring research conference. Prior course work in Chicano/Latino Studies helpful, i.e., CHC/LAT 61, 62, 63.",CHC/LAT,3.4770685631318794,medium
EECS112L,3.3661616161616164,19.0,1980.0,Organization of Digital Computers Laboratory,"Specification and implementation of a processor-based system using a hardware description language such as VHDL. Hands-on experience with design tools including simulation, synthesis, and evaluation using testbenches.",EECS,3.7543418328933273,medium
COGS108,3.7358490566037736,4.0,159.0,Neural Analytics,"Introduces the theoretical foundations and practical applications of neural data analysis. Topics include models of neural signals, neural time series analysis, and machine learning applications in cognitive neuroscience.",COGS,2.141552885337272,easy
EARTHSS141,3.7,3.0,100.0,Air Quality Management,"Fundamental science and terminology of regional air quality issues and developing and implementing the strategies used to prevent and mitigate air pollution impacts. Topics include setting regional air quality goals, applying measurements and numerical models, cost/benefits analysis, evaluation and enforcement.",EARTHSS,2.297947060378021,medium
INTLST17,3.740740740740741,16.0,1053.0,Global Environmental Issues,"Examines problems such as global climate change, growing human populations, fisheries depletion, ocean acidification, biodiversity loss, deforestation, and food security. Introduces political, social, and economic factors contributing to environmental issues and their disproportional impacts on the world’s poor and minorities.",INTL ST,2.1202125495617308,easy
PSYBEH193F,3.247058823529412,3.0,85.0,Family Law,"Examines legal issues surrounding marriage, cohabitation, divorce, child custody and support, adoption, and the rights of parents and children in the family context. The findings of social science research are used to illuminate the legal issues.",PSY BEH,4.273936621806191,medium
ENGRMAE171,3.1466666666666665,4.0,150.0,Digital Control Systems,"Methods for analysis and design of discrete-time control systems. Z-transforms, difference equations, discrete Fourier transforms. Sampling theorem and applications. Z-plane stability, frequency response. Digital controller design. Introduction to digital filters.",ENGRMAE,4.711904870919278,medium
BIOSCI99,2.984061148308349,69.0,16877.0,Molecular Biology,Biochemistry and replication of nucleic acids; molecular genetics; protein biosynthesis; genetic code; regulation of expression of genetic information; biochemical evolution.,BIO SCI,5.421283535518381,hard
MGMT127,3.8151898734177214,4.0,395.0,Business Ethics,Comprehensive introduction to ethical considerations in business with a focus on awareness to the complexity of ethical decision-making and how to make choices from a standpoint of ethical consciousness.,MGMT,1.7954226724889246,easy
PHYSCI5,3.665644171779141,19.0,326.0,California Teach 1: Introduction to Science and Mathematics Teaching,"First in a series for students interested in becoming middle or high school teachers of mathematics or science. Students gain an understanding of effective, research-based teaching strategies. Includes supervised field experience in a K-12 classroom.",PHY SCI,2.4478269155672194,medium
ARTHIS162C,3.2565789473684212,5.0,152.0,Contemporary Japan,"Study of various media of Japanese art from the time of war defeat in 1945 until the present. Topics include artists' responses to the nuclear bomb, the aesthetics of the ""economic miracle,"" avant-garde groups, manga, and innovations in architecture.",ART HIS,4.2324043736763794,medium
JAPANSE3B,3.261363636363636,9.0,176.0,Advanced Japanese,"Students are taught to conceptualize in Japanese as they learn to understand, read, write, and speak. Authentic Japanese texts are used. Approximately 360 kanji (Chinese characters) in addition to the 270 characters learned in 1A-B-C and 2A-B-C are introduced.",JAPANSE,4.211530812162508,medium
ANTHRO151A,3.4545454545454546,3.0,77.0,"Improvisation, Language, and Culture","Addresses improvisation, both in performance and in everyday life. Examines improvisation as the ""flexible regulation"" of everyday behavior by exploring different scholarly treatments of language and interaction, and working on developing actual theatrical improvisation skills.",ANTHRO,3.3687607660398053,medium
ENGLISH102C,3.398530762167126,54.0,2178.0,Topics in Romantic and 19th-Century Literature,"Studies of works representative of Romantic and 19th-century literature in English, with attention to literary history, treating at a minimum more than one author and more than one genre.",ENGLISH,3.6131290265911282,medium
ARTHIS42D,3.345029239766082,4.0,171.0,History of Asian Art: Arts of Islam,"Examines past and present Islamic art, spanning 1,500 years and extending from the Americas through Indonesia. Themes include Islam as a globalizing force, the definition of ""Islamic,"" and the competing roles of religion and politics in making art.",ART HIS,3.8465333962462758,medium
BME121,2.9107806691449816,13.0,1345.0,Quantitative Physiology: Organ Transport Systems,"A quantitative and systems approach to understanding physiological systems. Systems covered include the cardiopulmonary, circulatory, and renal systems.",BME,5.740975074741181,hard
MGMT138,3.5485477178423235,18.0,1205.0,Auditing,"An introduction to auditing practice with emphasis on the verification of financial statements and related information. Topics include professional ethics, assessment of audit risk, study and evaluation of internal control, gathering and evaluating audit evidence, and audit reporting.",MGMT,2.958668902737337,medium
ARABIC51,3.948186528497409,6.0,193.0,Introduction to the Koran,"An introduction to understanding the Koran and its significance to Muslim life, culture, and history. An overview of scholarly traditions related to the Koran, and its critics. Close readings of the Koran in English translation.",ARABIC,1.215214875551322,easy
PHYSICS138,2.9289940828402368,7.0,169.0,Astrophysics of Galaxies,"Introduction to the solar neighborhood, Milky Way, and other galaxies. Interstellar medium. Star formation. Stellar populations. Evolution of spiral, elliptical, and irregular galaxies. Supermassive black holes, quasars, and active galaxies. Galaxies as probes of the expansion rate of the Universe.",PHYSICS,5.661517703211758,hard
EAS126,3.5976331360946747,5.0,169.0,Topics in East Asian Linguistics,"In-depth examination of selected topics in the linguistics of East Asian languages, including Chinese, Japanese, Korean, and Vietnamese.",EAS,2.7445301157964686,medium
ART12C,3.0502793296089385,3.0,179.0,Intelligences of Arts,"Introduces contemporary neuroscience and new approaches to cognition – embodied, enactive, extended, situated, distributed. Reviews the history of related ethological, biological, psychological, technological, and philosophical traditions. Considers arts and cultural practices from these and other perspectives, and considers case studies.",ART,5.132401795848992,hard
MGMT191W,3.6934959349593495,50.0,3690.0,Business Communication,"Provides students with a solid foundation in business communication. Emphasis is placed on improving students' written and oral communication skills to help them succeed in (1) upper-division Business Administration courses, (2) graduate school, and (3) work and career activities.",MGMT,2.3263215277367206,medium
EARTHSS1,2.9722222222222223,25.0,5868.0,Introduction to Earth System Science,"Covers the origin and evolution of the Earth, its atmosphere, and oceans, from the perspective of biogeochemical cycles, energy use, and human impacts on the Earth system.",EARTHSS,5.472931730869029,hard
PSCI173S,3.526190476190476,6.0,2100.0,Social Relationships,"Examines major issues, concepts, and methods in the scientific study of social relationships. Topics include relationship formation and dissolution, friendships and love relationships, loneliness, bereavement, societal influences on close relationships, significance of close relationships for health and well-being.",PSCI,3.0562040318475217,medium
CHEM1P,2.505276225946617,10.0,1611.0,Preparation for General Chemistry ,"Units of measurement, dimensional analysis, significant figures; elementary concepts of volume, mass, force, pressure, energy, density, temperature, heat, work; fundamentals of atomic and molecular structure; the mole concept, stoichiometry; properties of the states of matter; gas laws; solutions concentrations.",CHEM,7.51001836004457,hard
HUMANH1AS,3.637225042301184,170.0,2955.0,Humanities Core Writing: Honors,"For Campuswide Honors students exploring the ideas presented in the companion lecture course and illustrated in the literary, historical, philosophical, and media works assigned.",HUMAN,2.571807481058963,medium
BIOSCI9A,3.638132295719844,6.0,257.0,Nutrition Science,"An introduction to nutrition science, integrating concepts from biology, biochemistry, microbiology, physiology, and psychology to explain the interaction between nutrients and the human body. Biological basis of nutrient standards is analyzed. Effects of nutrition, behavior, exercises on health/disease.",BIO SCI,2.5678495205599607,medium
ASIANAM151D,3.736,5.0,125.0,Vietnamese American Studies,"Studies the resettlement of Vietnamese in the United States following their exodus from Southeast Asia. Topics include the Vietnam War, the 1975 evacuation, boat and land refugees, the shaping of Vietnamese communities, and Vietnamese American literature.",ASIANAM,2.140894383547626,easy
ENGRCEE163,3.224,11.0,375.0,Wastewater Treatment Process Design,"Design of biological treatment processes. Topics include attached and suspended growth, aeration, anaerobic systems, process control, and economics. Design projects included. Materials Fee",ENGRCEE,4.3745324540243535,medium
ASIANAM111,3.39622641509434,3.0,53.0,Asian American History,Introduction to important themes in the history of people of Asian ancestry in the United States from the nineteenth century to the present.,ASIANAM,3.6231819120391084,medium
ART170,3.74,6.0,100.0,Advanced Projects,"Students working in different mediums focus on ambitious research, planning, development, and experimentation, leading to a single work or focused series that is large in scope. The project is exhibited and documented at the end of the quarter. Materials Fee",ART,2.123444086122027,easy
PSYBEH185S,3.3689320388349513,3.0,927.0,Industrial-Organizational Psychology,"Examines the application of social psychology to organizational settings. Topics include motivation of workers, group decision-making, leadership styles, career management, and organizational development.",PSY BEH,3.7422556579822475,medium
